"vid","date","feed KG","Feed Type"
"O6552","06/01/2024",18.32," hay "
"S5427","06/01/2024",19.31,"Hay"
"N9197","06-01-2024",24.68,"silage"
"C7126","06-01-2024",20.21,"silage"
"J9639","2024-06-01",20.39," silage"
"R3357","01 Jun 2024",25.15,"hay"
"V3979","01 Jun 2024",21.38,"hay"
"K9325","06/01/2024",16.2,"hay"
"E3229","2024-06-01",17.94,"hay"
"T5602","06-01-2024",18.66,"hay"
"N9692","06/01/2024",23.67," silage"
"V4575","06/01/2024",21.08,"Hay"
"Y3782","01 Jun 2024",21.2,"silage"
"Z7830","06-01-2024",20.33," silage"
"E5966","2024-06-01",18.33,"silage "
"S9300","2024-06-01",25.36,"Silage"
"Y7815","01 Jun 2024",21.49,"hay"
"Y9266","06-01-2024",14.1," hay "
"I1385","01 Jun 2024",22.1," silage"
"C4705","2024-06-01",18.58,"hay"
"H2377","2024-06-01",16.8,"silage"
"Z4043","2024-06-01",19.35,"Silage"
"G685","01 Jun 2024",16.92," hay "
"J6077","2024-06-01",17.81," silage"
"I5026","01 Jun 2024",18.12,"silage"
"S6386","06/01/2024",14.94," hay "
"D9038","01 Jun 2024",22.51,"hay"
"N7280","2024-06-01",20.46,"hay"
"Q9174","2024-06-01",16.59,"corn silage"
"K4714","01 Jun 2024",23.76," hay "
"G150","01 Jun 2024",21.28," hay "
"U6809","01 Jun 2024",19.11,"hay"
"L9829","01 Jun 2024",22.69,"hay"
"O8173","01 Jun 2024",22.63,"Hay"
"J6910","01 Jun 2024",22.46,"corn silage"
"M2207","2024-06-01",22.07,"hay"
"G1028","2024-06-01",21.66,"hay"
"I8517","01 Jun 2024",19.81,"corn silage"
"I7447","2024-06-01",19.08,"hay"
"J7734","01 Jun 2024",18.86,"hay"
"W8010","01 Jun 2024",17.92," silage"
"U1955","06-01-2024",19.38," hay "
"G8171","2024-06-01",16.2,"silage "
"U5357","06-01-2024",26.51,"silage"
"F5883","01 Jun 2024",23.62,"silage "
"Y4092","01 Jun 2024",16.63,"Silage"
"B984","06-01-2024",18.79," hay "
"E6182","06-01-2024",18.6,"silage"
"H985","06/01/2024",22.34,"silge"
"L4232","06/01/2024",19.75,"hay"
"M1583","01 Jun 2024",20.76,"Silage"
"R4684","2024-06-01",19.91,"hay"
"A7863","2024-06-01",19.87,"hay"
"Y4775","2024-06-01",24.11,"Silage"
"Y6643","06-01-2024",19.32,"corn silage"
"F9953","06-01-2024",24.55," hay "
"U8535","06/01/2024",15.35,"silage"
"O7477","2024-06-01",21.75,"corn silage"
"I2506","06-01-2024",20.37,"corn silage"
"O194","2024-06-01",20.65,"hay"
"Z3123","06/01/2024",21.14,"Hay"
"P6677","2024-06-01",18.49,"hay"
"T4649","2024-06-01",19,"hay"
"F2131","06-01-2024",16.94," hay "
"K3463","01 Jun 2024",16.78,"hay"
"H9517","06/01/2024",20.91,"corn silage"
"V3948","06/01/2024",21.34,"silage"
"V7756","2024-06-01",20.16,"silage "
"G2757","06-01-2024",22.77," silage"
"P3832","06/01/2024",26.15,"corn silage"
"Q711","06/01/2024",18.53,"Silage"
"V9643","06-01-2024",13.07,"silge"
"R5369","06/01/2024",23.02,"Hay"
"Q3500","01 Jun 2024",17.87," hay "
"B3068","01 Jun 2024",17.94,"hay"
"D8719","2024-06-01",23.08,"hay"
"M4054","06/01/2024",19.15,"Silage"
"E9760","01 Jun 2024",16.34,"corn silage"
"V472","2024-06-01",20.54,"corn silage"
"S6097","06/01/2024",19.58," silage"
"O6552","2024-06-02",20.02," hay "
"S5427","02 Jun 2024",21.16,"hay"
"N9197","06-02-2024",18.89,"silage "
"C7126","06-02-2024",21.93,"silage"
"J9639","06/02/2024",19.34,"Silage"
"R3357","02 Jun 2024",21," hay "
"V3979","06-02-2024",23.29,"hay"
"K9325","02 Jun 2024",21.31," hay "
"E3229","06/02/2024",19.02," hay "
"T5602","02 Jun 2024",23.45,"hay"
"N9692","06/02/2024",22.98," silage"
"V4575","06/02/2024",21.65," hay "
"Y3782","06/02/2024",20.72,"Silage"
"Z7830","2024-06-02",18.12,"silge"
"E5966","06-02-2024",24.08,"silge"
"S9300","02 Jun 2024",18.2," silage"
"Y7815","06/02/2024",26.56,"Hay"
"Y9266","2024-06-02",24.6,"hay"
"I1385","2024-06-02",19.29,"Silage"
"C4705","06/02/2024",16.92,"hay"
"H2377","06-02-2024",17.87,"silge"
"Z4043","02 Jun 2024",20.77,"silage "
"G685","06/02/2024",19.26,"Hay"
"J6077","2024-06-02",18.96," silage"
"I5026","02 Jun 2024",17.15,"silage"
"S6386","2024-06-02",19.86,"hay"
"D9038","06-02-2024",17.65,"hay"
"N7280","06/02/2024",15,"Hay"
"Q9174","02 Jun 2024",18.86," silage"
"K4714","06-02-2024",22.76,"Hay"
"G150","06-02-2024",18.27,"hay"
"U6809","02 Jun 2024",21.82,"Hay"
"L9829","06-02-2024",15.15,"hay"
"O8173","02 Jun 2024",19.83,"hay"
"J6910","2024-06-02",21.56,"corn silage"
"M2207","06-02-2024",20.9,"hay"
"G1028","06-02-2024",20.32," hay "
"I8517","06/02/2024",18.08,"Silage"
"I7447","06/02/2024",17.45,"Hay"
"J7734","02 Jun 2024",16.93,"hay"
"W8010","02 Jun 2024",20.35,"silage "
"U1955","2024-06-02",17.16," hay "
"G8171","02 Jun 2024",18.53,"Silage"
"U5357","2024-06-02",19.23,"silge"
"F5883","06-02-2024",25.53,"Silage"
"Y4092","02 Jun 2024",18.04," silage"
"B984","2024-06-02",20.71,"Hay"
"E6182","06/02/2024",20.23,"silage"
"H985","06-02-2024",17.11,"Silage"
"L4232","06-02-2024",19.79,"Hay"
"M1583","2024-06-02",24.33,"corn silage"
"R4684","2024-06-02",21.35," hay "
"A7863","06/02/2024",20.12,"hay"
"Y4775","2024-06-02",18.73,"silage "
"Y6643","06/02/2024",13.84,"Silage"
"F9953","06/02/2024",23.39,"Hay"
"U8535","2024-06-02",15.62,"corn silage"
"O7477","06/02/2024",22.22,"corn silage"
"I2506","2024-06-02",25.73,"silge"
"O194","06/02/2024",15.67,"Hay"
"Z3123","02 Jun 2024",22.11," hay "
"P6677","2024-06-02",19.21,"Hay"
"T4649","06/02/2024",15.28,"hay"
"F2131","06-02-2024",15.46," hay "
"K3463","06-02-2024",15.2," hay "
"H9517","02 Jun 2024",18.41,"silage "
"V3948","02 Jun 2024",15.61,"silage "
"V7756","06/02/2024",22.06,"Silage"
"G2757","2024-06-02",26.3," silage"
"P3832","06-02-2024",16.14,"silage "
"Q711","02 Jun 2024",22.36," silage"
"V9643","02 Jun 2024",22.31,"silage "
"R5369","06/02/2024",21,"Hay"
"Q3500","06-02-2024",16.97,"hay"
"B3068","2024-06-02",19.64,"Hay"
"D8719","02 Jun 2024",19.16," hay "
"M4054","06/02/2024",21.69,"silage "
"E9760","06-02-2024",18.88,"silage"
"V472","06/02/2024",22.93," silage"
"S6097","02 Jun 2024",18.88,"silage "
"O6552","06-03-2024",23.16,"hay"
"S5427","06-03-2024",16.85,"Hay"
"N9197","03 Jun 2024",16.22,"silge"
"C7126","06-03-2024",29.72,"Silage"
"J9639","06-03-2024",18.75,"Silage"
"R3357","06/03/2024",20.89,"hay"
"V3979","2024-06-03",21.91,"Hay"
"K9325","06/03/2024",18.55,"Hay"
"E3229","2024-06-03",21.55,"Hay"
"T5602","06-03-2024",21.11,"Hay"
"N9692","2024-06-03",19.35," silage"
"V4575","03 Jun 2024",20.2,"hay"
"Y3782","2024-06-03",19.9,"silge"
"Z7830","2024-06-03",26.39,"Silage"
"E5966","06-03-2024",17.78,"silge"
"S9300","03 Jun 2024",16.71,"Silage"
"Y7815","2024-06-03",20.11," hay "
"Y9266","03 Jun 2024",20.93,"hay"
"I1385","03 Jun 2024",21.31,"Silage"
"C4705","06/03/2024",18.62," hay "
"H2377","03 Jun 2024",16.81,"silge"
"Z4043","06/03/2024",23.79,"silage"
"G685","2024-06-03",18.95," hay "
"J6077","03 Jun 2024",17.4,"silage "
"I5026","06-03-2024",19.29,"corn silage"
"S6386","06-03-2024",19.41,"Hay"
"D9038","06/03/2024",23.33,"hay"
"N7280","06-03-2024",20.25,"Hay"
"Q9174","03 Jun 2024",22.26,"silge"
"K4714","06-03-2024",18.5,"hay"
"G150","06/03/2024",20.64,"Hay"
"U6809","06-03-2024",19.03,"Hay"
"L9829","2024-06-03",20.28,"Hay"
"O8173","06/03/2024",17.31,"hay"
"J6910","03 Jun 2024",16.07,"Silage"
"M2207","06/03/2024",25.99,"hay"
"G1028","06/03/2024",21.8,"hay"
"I8517","06/03/2024",16.25,"silage "
"I7447","06-03-2024",18.17," hay "
"J7734","2024-06-03",16.44,"hay"
"W8010","06/03/2024",26.6,"silage "
"U1955","2024-06-03",23.94," hay "
"G8171","06-03-2024",19.2,"corn silage"
"U5357","06-03-2024",21.63,"silage"
"F5883","2024-06-03",18.76,"Silage"
"Y4092","06-03-2024",18.57," silage"
"B984","03 Jun 2024",17.63,"Hay"
"E6182","06-03-2024",18.22," silage"
"H985","2024-06-03",24.95," silage"
"L4232","06-03-2024",19.84," hay "
"M1583","2024-06-03",20.36,"silage "
"R4684","06/03/2024",20.73," hay "
"A7863","06-03-2024",23.7," hay "
"Y4775","03 Jun 2024",18.45,"silage "
"Y6643","2024-06-03",17.02,"Silage"
"F9953","03 Jun 2024",25.03,"Hay"
"U8535","03 Jun 2024",18.68,"silage "
"O7477","06/03/2024",17.83,"silage"
"I2506","06-03-2024",16.29,"silage "
"O194","06/03/2024",16.15,"hay"
"Z3123","06/03/2024",18.28,"Hay"
"P6677","06-03-2024",21.85,"Hay"
"T4649","06/03/2024",23.33,"Hay"
"F2131","06-03-2024",22.12,"hay"
"K3463","06/03/2024",18.91,"Hay"
"H9517","03 Jun 2024",20.18,"silage "
"V3948","06/03/2024",17.89,"silage"
"V7756","03 Jun 2024",17.85,"silge"
"G2757","2024-06-03",22.65,"Silage"
"P3832","06/03/2024",16.95," silage"
"Q711","03 Jun 2024",25.87,"corn silage"
"V9643","2024-06-03",19.73,"corn silage"
"R5369","03 Jun 2024",20.64,"Hay"
"Q3500","06-03-2024",17.78," hay "
"B3068","06-03-2024",18.28,"Hay"
"D8719","06-03-2024",16.05," hay "
"M4054","03 Jun 2024",19.45,"Silage"
"E9760","06/03/2024",21.26,"Silage"
"V472","06-03-2024",20.97,"silge"
"S6097","06/03/2024",17.66,"Silage"
"O6552","2024-06-04",17.63,"hay"
"S5427","2024-06-04",18.49,"Hay"
"N9197","04 Jun 2024",24.49,"Silage"
"C7126","2024-06-04",16.59,"corn silage"
"J9639","06/04/2024",19.46,"silage"
"R3357","2024-06-04",25.71," hay "
"V3979","04 Jun 2024",19.7,"Hay"
"K9325","04 Jun 2024",15.92," hay "
"E3229","06/04/2024",18.01,"hay"
"T5602","04 Jun 2024",21.46,"Hay"
"N9692","04 Jun 2024",18.87,"corn silage"
"V4575","06/04/2024",18.31,"Hay"
"Y3782","06-04-2024",18.97,"corn silage"
"Z7830","04 Jun 2024",20.27,"silge"
"E5966","06-04-2024",24.8,"Silage"
"S9300","06-04-2024",19.73," silage"
"Y7815","2024-06-04",23.24," hay "
"Y9266","06/04/2024",21.89,"hay"
"I1385","06/04/2024",19.66,"corn silage"
"C4705","04 Jun 2024",15.4," hay "
"H2377","06/04/2024",18.44,"silage "
"Z4043","2024-06-04",18.53,"silge"
"G685","06-04-2024",20.14,"Hay"
"J6077","06/04/2024",23.9,"corn silage"
"I5026","06-04-2024",26.88,"silge"
"S6386","06-04-2024",24.64," hay "
"D9038","2024-06-04",19.6,"Hay"
"N7280","06/04/2024",14.73,"hay"
"Q9174","2024-06-04",18.83,"Silage"
"K4714","06/04/2024",20.27,"hay"
"G150","04 Jun 2024",22.54," hay "
"U6809","2024-06-04",22.89,"hay"
"L9829","06/04/2024",22.05," hay "
"O8173","2024-06-04",15.81," hay "
"J6910","2024-06-04",22.55," silage"
"M2207","04 Jun 2024",18.66,"hay"
"G1028","04 Jun 2024",20.52," hay "
"I8517","2024-06-04",20.22,"silage "
"I7447","2024-06-04",21.28," hay "
"J7734","06-04-2024",20.07,"hay"
"W8010","04 Jun 2024",15,"silage "
"U1955","2024-06-04",22.21,"Hay"
"G8171","06-04-2024",21.16,"silage"
"U5357","06-04-2024",19.2,"corn silage"
"F5883","06-04-2024",20.35,"silge"
"Y4092","06-04-2024",20.4,"Silage"
"B984","06/04/2024",20.66," hay "
"E6182","06/04/2024",24.92,"Silage"
"H985","2024-06-04",19.34,"silage"
"L4232","2024-06-04",20.5,"hay"
"M1583","06-04-2024",23.51,"silage"
"R4684","06-04-2024",23.16," hay "
"A7863","2024-06-04",23.44,"hay"
"Y4775","2024-06-04",18.27,"Silage"
"Y6643","06-04-2024",26.01,"corn silage"
"F9953","2024-06-04",20.2,"Hay"
"U8535","2024-06-04",25.6,"corn silage"
"O7477","06-04-2024",15.95,"silge"
"I2506","06/04/2024",20.06,"silage"
"O194","04 Jun 2024",23.75,"Hay"
"Z3123","04 Jun 2024",17.85,"hay"
"P6677","04 Jun 2024",17.74,"Hay"
"T4649","06-04-2024",17.18," hay "
"F2131","04 Jun 2024",16.84," hay "
"K3463","2024-06-04",18.69,"hay"
"H9517","2024-06-04",20.99,"silage "
"V3948","06/04/2024",13.96," silage"
"V7756","2024-06-04",20.64,"silge"
"G2757","06-04-2024",23.71,"silage"
"P3832","2024-06-04",26.11,"silage"
"Q711","2024-06-04",23.9,"silage"
"V9643","06-04-2024",22.27,"silge"
"R5369","06-04-2024",14.82,"hay"
"Q3500","04 Jun 2024",18.2," hay "
"B3068","2024-06-04",18.94,"hay"
"D8719","06-04-2024",22.11,"hay"
"M4054","06-04-2024",19.68,"corn silage"
"E9760","04 Jun 2024",16.22,"corn silage"
"V472","2024-06-04",25.05,"silage"
"S6097","06-04-2024",22.73,"silage "
"O6552","05 Jun 2024",20.71,"Hay"
"S5427","06/05/2024",23.65,"hay"
"N9197","06/05/2024",15.98,"corn silage"
"C7126","05 Jun 2024",21.98,"silage"
"J9639","06-05-2024",18.43," silage"
"R3357","05 Jun 2024",22.05,"hay"
"V3979","05 Jun 2024",19.82," hay "
"K9325","05 Jun 2024",21.9,"Hay"
"E3229","2024-06-05",24.01," hay "
"T5602","06/05/2024",20.02," hay "
"N9692","06-05-2024",23.05,"silge"
"V4575","2024-06-05",16.43," hay "
"Y3782","06-05-2024",17.84,"silge"
"Z7830","2024-06-05",24.56," silage"
"E5966","2024-06-05",NA,"Silage"
"S9300","2024-06-05",13.84,"silage "
"Y7815","05 Jun 2024",15.91,"hay"
"Y9266","05 Jun 2024",19.4,"Hay"
"I1385","06-05-2024",22.6,"silge"
"C4705","06/05/2024",19.69," hay "
"H2377","2024-06-05",21.87,"silage"
"Z4043","06/05/2024",22.88,"Silage"
"G685","06-05-2024",25.01," hay "
"J6077","06/05/2024",20.17,"Silage"
"I5026","06/05/2024",19.84,"silage"
"S6386","05 Jun 2024",14.74," hay "
"D9038","06/05/2024",20.3,"hay"
"N7280","2024-06-05",18.28,"Hay"
"Q9174","06/05/2024",17.08," silage"
"K4714","05 Jun 2024",19.46,"Hay"
"G150","05 Jun 2024",23.04,"Hay"
"U6809","2024-06-05",14.02,"Hay"
"L9829","05 Jun 2024",18.72,"Hay"
"O8173","06-05-2024",20.35," hay "
"J6910","05 Jun 2024",17.32,"corn silage"
"M2207","06/05/2024",21,"Hay"
"G1028","05 Jun 2024",21.23,"hay"
"I8517","05 Jun 2024",19.9," silage"
"I7447","2024-06-05",12.6,"hay"
"J7734","06-05-2024",27.71,"Hay"
"W8010","06/05/2024",19.38,"silage"
"U1955","06/05/2024",21.95," hay "
"G8171","06/05/2024",20.82,"silage "
"U5357","06-05-2024",23.07," silage"
"F5883","06-05-2024",22.45,"Silage"
"Y4092","06/05/2024",19.37,"silage "
"B984","06-05-2024",21.13,"hay"
"E6182","06-05-2024",17.16,"Silage"
"H985","06/05/2024",22.57,"silge"
"L4232","06-05-2024",18.62,"hay"
"M1583","06/05/2024",27.25,"silge"
"R4684","06/05/2024",15.05," hay "
"A7863","06-05-2024",18.61,"hay"
"Y4775","06-05-2024",22.48,"silage"
"Y6643","05 Jun 2024",21.53,"silage"
"F9953","2024-06-05",18.23," hay "
"U8535","2024-06-05",17.01," silage"
"O7477","06-05-2024",20.43,"silage "
"I2506","05 Jun 2024",19.96,"corn silage"
"O194","2024-06-05",14.63,"Hay"
"Z3123","2024-06-05",20.1," hay "
"P6677","2024-06-05",20.57,"hay"
"T4649","05 Jun 2024",20.52," hay "
"F2131","2024-06-05",16.83," hay "
"K3463","06/05/2024",21.43," hay "
"H9517","06/05/2024",24.14," silage"
"V3948","06/05/2024",21.37,"silage "
"V7756","06-05-2024",16.59,"silage "
"G2757","05 Jun 2024",18.69,"corn silage"
"P3832","2024-06-05",21.04," silage"
"Q711","06/05/2024",18.06,"corn silage"
"V9643","06/05/2024",13.53,"Silage"
"R5369","05 Jun 2024",22.65,"Hay"
"Q3500","2024-06-05",17.51,"Hay"
"B3068","2024-06-05",18.28," hay "
"D8719","2024-06-05",24.51,"hay"
"M4054","06/05/2024",17.68,"silage"
"E9760","2024-06-05",22.54,"silge"
"V472","2024-06-05",16.22,"corn silage"
"S6097","06-05-2024",18.94,"corn silage"
"O6552","06-06-2024",19.78,"Hay"
"S5427","2024-06-06",16.49," hay "
"N9197","06 Jun 2024",18.1,"corn silage"
"C7126","06 Jun 2024",NA,"silage"
"J9639","06/06/2024",22.01," silage"
"R3357","06 Jun 2024",15.05," hay "
"V3979","2024-06-06",18.95," hay "
"K9325","06/06/2024",22.27,"hay"
"E3229","06-06-2024",18.38,"hay"
"T5602","06/06/2024",20.68," hay "
"N9692","06 Jun 2024",21.48,"silage"
"V4575","06/06/2024",20.8," hay "
"Y3782","06-06-2024",21.96," silage"
"Z7830","06/06/2024",19.63,"silage"
"E5966","06 Jun 2024",18.76,"corn silage"
"S9300","06-06-2024",12.07,"silage"
"Y7815","06-06-2024",19.72," hay "
"Y9266","2024-06-06",21.29," hay "
"I1385","06 Jun 2024",21.61,"silage "
"C4705","2024-06-06",18.33,"hay"
"H2377","06 Jun 2024",25.34,"silage "
"Z4043","06 Jun 2024",20.86,"silage"
"G685","2024-06-06",20.38," hay "
"J6077","06 Jun 2024",23.82,"corn silage"
"I5026","06-06-2024",17.84,"corn silage"
"S6386","2024-06-06",18.65,"hay"
"D9038","06-06-2024",27.19," hay "
"N7280","06 Jun 2024",20.03," hay "
"Q9174","2024-06-06",24.9,"Silage"
"K4714","2024-06-06",15.68," hay "
"G150","2024-06-06",19.43,"hay"
"U6809","2024-06-06",21.14," hay "
"L9829","06/06/2024",20.9,"hay"
"O8173","2024-06-06",16.98,"hay"
"J6910","06/06/2024",20.06,"Silage"
"M2207","06 Jun 2024",16.77," hay "
"G1028","2024-06-06",22.14,"Hay"
"I8517","06-06-2024",23.25,"Silage"
"I7447","06-06-2024",13.33,"Hay"
"J7734","06/06/2024",23.71," hay "
"W8010","2024-06-06",16.28,"corn silage"
"U1955","06/06/2024",21.36,"Hay"
"G8171","06 Jun 2024",21.98,"Silage"
"U5357","06/06/2024",19.4,"corn silage"
"F5883","06/06/2024",18.06,"Silage"
"Y4092","2024-06-06",20.5,"silage"
"B984","2024-06-06",21.32,"Hay"
"E6182","06 Jun 2024",22.65,"Silage"
"H985","06/06/2024",13.84,"silge"
"L4232","2024-06-06",15.09," hay "
"M1583","2024-06-06",24.29,"Silage"
"R4684","06 Jun 2024",23.14,"hay"
"A7863","06 Jun 2024",21.31,"Hay"
"Y4775","06-06-2024",22.15,"silge"
"Y6643","2024-06-06",22.75,"Silage"
"F9953","06 Jun 2024",12.02," hay "
"U8535","06 Jun 2024",23.33,"Silage"
"O7477","2024-06-06",18.55,"Silage"
"I2506","06/06/2024",20.69,"silge"
"O194","06/06/2024",19.11,"hay"
"Z3123","2024-06-06",22.62,"hay"
"P6677","06 Jun 2024",18.95,"hay"
"T4649","06 Jun 2024",21.56,"Hay"
"F2131","06/06/2024",18.83,"Hay"
"K3463","06/06/2024",16.72,"Hay"
"H9517","06 Jun 2024",23.63,"silage"
"V3948","06/06/2024",22.22,"silage "
"V7756","2024-06-06",25.17,"silge"
"G2757","06-06-2024",20.2,"silge"
"P3832","2024-06-06",23.38,"silage"
"Q711","06 Jun 2024",25.93,"silage"
"V9643","2024-06-06",19.16,"silage"
"R5369","06/06/2024",16.03," hay "
"Q3500","2024-06-06",19.28,"hay"
"B3068","06/06/2024",19.36," hay "
"D8719","06 Jun 2024",20.46," hay "
"M4054","06 Jun 2024",25.14," silage"
"E9760","06 Jun 2024",19.02,"silge"
"V472","2024-06-06",21.12,"silage "
"S6097","06 Jun 2024",19.32,"silge"
"O6552","06-07-2024",20.06,"Hay"
"S5427","07 Jun 2024",20.94,"hay"
"N9197","06-07-2024",23.98,"corn silage"
"C7126","07 Jun 2024",20.36,"silge"
"J9639","06-07-2024",22.14,"Silage"
"R3357","2024-06-07",22.34,"Hay"
"V3979","2024-06-07",22.74,"hay"
"K9325","2024-06-07",18.28,"hay"
"E3229","06-07-2024",24.88,"hay"
"T5602","07 Jun 2024",18.86," hay "
"N9692","06/07/2024",19.68,"Silage"
"V4575","2024-06-07",24.21," hay "
"Y3782","2024-06-07",23.88,"silage "
"Z7830","06-07-2024",16.73," silage"
"E5966","2024-06-07",17.38,"silage"
"S9300","2024-06-07",15.93,"silge"
"Y7815","2024-06-07",20.55,"hay"
"Y9266","06-07-2024",20.49,"hay"
"I1385","06/07/2024",21.09,"Silage"
"C4705","07 Jun 2024",21.66,"Hay"
"H2377","2024-06-07",18.19," silage"
"Z4043","07 Jun 2024",17.02,"silage "
"G685","06-07-2024",23.08,"Hay"
"J6077","07 Jun 2024",22.25," silage"
"I5026","2024-06-07",15.47,"silge"
"S6386","06/07/2024",19.71,"hay"
"D9038","06-07-2024",17.31,"Hay"
"N7280","06-07-2024",13.79,"Hay"
"Q9174","06-07-2024",20.45,"corn silage"
"K4714","06/07/2024",19.76,"hay"
"G150","06/07/2024",19.71,"Hay"
"U6809","07 Jun 2024",20.65,"Hay"
"L9829","2024-06-07",22.65,"Hay"
"O8173","2024-06-07",20.62,"Hay"
"J6910","06-07-2024",18.15,"silge"
"M2207","07 Jun 2024",17.8,"hay"
"G1028","07 Jun 2024",NA," hay "
"I8517","06/07/2024",20.93,"silage "
"I7447","07 Jun 2024",16.88,"hay"
"J7734","06/07/2024",19.45,"hay"
"W8010","06/07/2024",22.9,"corn silage"
"U1955","06-07-2024",19.68,"Hay"
"G8171","2024-06-07",17.9,"silage"
"U5357","2024-06-07",19.17,"corn silage"
"F5883","07 Jun 2024",23.34,"silage"
"Y4092","2024-06-07",21.65,"silge"
"B984","06/07/2024",23.71," hay "
"E6182","06-07-2024",20.42,"silge"
"H985","06/07/2024",21.23,"Silage"
"L4232","07 Jun 2024",18.32,"hay"
"M1583","06/07/2024",21.82,"silge"
"R4684","07 Jun 2024",18.48," hay "
"A7863","07 Jun 2024",15.74,"Hay"
"Y4775","06-07-2024",20.38," silage"
"Y6643","07 Jun 2024",25.84,"Silage"
"F9953","07 Jun 2024",22.4," hay "
"U8535","2024-06-07",23.5,"silage "
"O7477","07 Jun 2024",21.08,"silage "
"I2506","07 Jun 2024",18.17,"Silage"
"O194","06-07-2024",19.39,"hay"
"Z3123","07 Jun 2024",19.18," hay "
"P6677","06-07-2024",18.59," hay "
"T4649","06-07-2024",22.11,"hay"
"F2131","2024-06-07",16.41,"Hay"
"K3463","06-07-2024",22.6,"hay"
"H9517","07 Jun 2024",22.59,"Silage"
"V3948","2024-06-07",16.4," silage"
"V7756","06/07/2024",21.92," silage"
"G2757","06/07/2024",27.29,"corn silage"
"P3832","07 Jun 2024",18.33," silage"
"Q711","07 Jun 2024",22.53,"silage"
"V9643","2024-06-07",17.65,"silage "
"R5369","06/07/2024",23.33," hay "
"Q3500","06/07/2024",20.75,"Hay"
"B3068","06/07/2024",24.96," hay "
"D8719","06/07/2024",15.62,"hay"
"M4054","06-07-2024",19.85,"silage "
"E9760","07 Jun 2024",18.42,"silage"
"V472","07 Jun 2024",19.41,"corn silage"
"S6097","06-07-2024",18.11," silage"
"O6552","2024-06-08",17.5," hay "
"S5427","2024-06-08",21.74," hay "
"N9197","06-08-2024",16.74,"Silage"
"C7126","06/08/2024",24.45," silage"
"J9639","06/08/2024",16.44,"Silage"
"R3357","2024-06-08",20.3," hay "
"V3979","06/08/2024",21.6,"hay"
"K9325","06-08-2024",21.76,"Hay"
"E3229","2024-06-08",19.09,"hay"
"T5602","2024-06-08",20.24," hay "
"N9692","2024-06-08",22.88,"silage "
"V4575","08 Jun 2024",15.63,"hay"
"Y3782","06/08/2024",17.65,"silge"
"Z7830","2024-06-08",20.96,"Silage"
"E5966","2024-06-08",18.67,"silge"
"S9300","2024-06-08",24.11," silage"
"Y7815","2024-06-08",22.02,"hay"
"Y9266","2024-06-08",20.22,"Hay"
"I1385","06-08-2024",15.48," silage"
"C4705","2024-06-08",20.08," hay "
"H2377","08 Jun 2024",19.05,"silage"
"Z4043","06/08/2024",19.69,"silage"
"G685","2024-06-08",16.46,"hay"
"J6077","08 Jun 2024",21.5,"silage"
"I5026","2024-06-08",16.88,"corn silage"
"S6386","08 Jun 2024",19.32,"hay"
"D9038","06-08-2024",21.14," hay "
"N7280","2024-06-08",17.65," hay "
"Q9174","08 Jun 2024",21.75,"Silage"
"K4714","2024-06-08",16.05,"Hay"
"G150","08 Jun 2024",11.57,"Hay"
"U6809","06-08-2024",21.39,"hay"
"L9829","06/08/2024",22.52," hay "
"O8173","08 Jun 2024",19.14,"hay"
"J6910","06-08-2024",21.51,"silge"
"M2207","08 Jun 2024",16.53,"hay"
"G1028","06/08/2024",19.62,"hay"
"I8517","06/08/2024",14.18,"silge"
"I7447","2024-06-08",23.54,"hay"
"J7734","08 Jun 2024",25.58,"Hay"
"W8010","06/08/2024",23.22,"silage "
"U1955","06/08/2024",19.92,"Hay"
"G8171","06/08/2024",19.9,"corn silage"
"U5357","08 Jun 2024",15.45,"silage"
"F5883","06-08-2024",22.37,"corn silage"
"Y4092","06-08-2024",19.37,"silge"
"B984","08 Jun 2024",18.03,"Hay"
"E6182","08 Jun 2024",15.76,"silge"
"H985","08 Jun 2024",19.1,"corn silage"
"L4232","06-08-2024",17.45," hay "
"M1583","2024-06-08",18.81,"corn silage"
"R4684","2024-06-08",16.35,"Hay"
"A7863","06-08-2024",25.06,"hay"
"Y4775","06/08/2024",19.95,"corn silage"
"Y6643","06-08-2024",23.22," silage"
"F9953","06/08/2024",12.19,"hay"
"U8535","08 Jun 2024",18.64,"silage"
"O7477","06-08-2024",17.97,"silge"
"I2506","08 Jun 2024",16.33," silage"
"O194","06-08-2024",24.64," hay "
"Z3123","2024-06-08",15.75," hay "
"P6677","06-08-2024",20.96,"hay"
"T4649","2024-06-08",22.54,"hay"
"F2131","2024-06-08",20.53," hay "
"K3463","08 Jun 2024",17.37,"hay"
"H9517","2024-06-08",22.82,"silage "
"V3948","06-08-2024",20.51," silage"
"V7756","06/08/2024",16.81,"silage"
"G2757","06-08-2024",15.84,"silage"
"P3832","06-08-2024",26.26,"silage"
"Q711","2024-06-08",17.96,"silage"
"V9643","06/08/2024",14.43,"silage"
"R5369","06-08-2024",21.6,"Hay"
"Q3500","06/08/2024",20.93,"Hay"
"B3068","06/08/2024",15.94,"Hay"
"D8719","08 Jun 2024",14.17,"hay"
"M4054","06-08-2024",19.65,"corn silage"
"E9760","06-08-2024",23.42,"silage"
"V472","2024-06-08",21.91,"corn silage"
"S6097","06-08-2024",18.52,"silge"
"O6552","09 Jun 2024",17.5," hay "
"S5427","2024-06-09",20.81," hay "
"N9197","2024-06-09",20.47,"corn silage"
"C7126","06/09/2024",21.89,"corn silage"
"J9639","06/09/2024",18.81,"Silage"
"R3357","06/09/2024",22.7,"hay"
"V3979","2024-06-09",17.51," hay "
"K9325","06-09-2024",19.01,"Hay"
"E3229","06-09-2024",22.22," hay "
"T5602","2024-06-09",22.97," hay "
"N9692","09 Jun 2024",14.18," silage"
"V4575","09 Jun 2024",20.32,"Hay"
"Y3782","2024-06-09",21.83,"silge"
"Z7830","2024-06-09",15.65,"silage"
"E5966","2024-06-09",21.44,"Silage"
"S9300","06/09/2024",17.52,"silage"
"Y7815","09 Jun 2024",23.06,"Hay"
"Y9266","2024-06-09",21.62," hay "
"I1385","06/09/2024",22.31,"silage"
"C4705","06-09-2024",NA,"Hay"
"H2377","2024-06-09",22.59,"corn silage"
"Z4043","06-09-2024",24.14,"Silage"
"G685","06-09-2024",25.9,"hay"
"J6077","09 Jun 2024",19.91,"Silage"
"I5026","09 Jun 2024",13.25,"silage"
"S6386","06/09/2024",20.09," hay "
"D9038","2024-06-09",20.62," hay "
"N7280","06-09-2024",19.53,"hay"
"Q9174","09 Jun 2024",21.7,"corn silage"
"K4714","06/09/2024",23.03,"Hay"
"G150","06-09-2024",18.45," hay "
"U6809","06-09-2024",19.12," hay "
"L9829","06-09-2024",21.19," hay "
"O8173","2024-06-09",18.35,"Hay"
"J6910","06/09/2024",20.27,"silge"
"M2207","09 Jun 2024",14.11,"Hay"
"G1028","09 Jun 2024",16.64,"Hay"
"I8517","06-09-2024",16.02,"Silage"
"I7447","2024-06-09",17.44,"hay"
"J7734","06/09/2024",17.92," hay "
"W8010","06-09-2024",21.15,"silage"
"U1955","09 Jun 2024",22.95,"hay"
"G8171","09 Jun 2024",17.82,"Silage"
"U5357","09 Jun 2024",17.01," silage"
"F5883","2024-06-09",16.87,"Silage"
"Y4092","2024-06-09",18.76,"silage"
"B984","09 Jun 2024",NA,"Hay"
"E6182","06/09/2024",21.45,"Silage"
"H985","06/09/2024",19.04,"silage "
"L4232","06-09-2024",13.76,"hay"
"M1583","06-09-2024",19.73,"silge"
"R4684","09 Jun 2024",23.56,"hay"
"A7863","06-09-2024",23.57,"hay"
"Y4775","06/09/2024",17.63,"silage "
"Y6643","2024-06-09",15.36," silage"
"F9953","06-09-2024",27.37,"hay"
"U8535","06/09/2024",19.51,"silage "
"O7477","2024-06-09",19.71,"Silage"
"I2506","06-09-2024",21.26,"Silage"
"O194","09 Jun 2024",15.16,"Hay"
"Z3123","09 Jun 2024",17.82,"hay"
"P6677","06/09/2024",15.38,"Hay"
"T4649","06-09-2024",17.92,"hay"
"F2131","2024-06-09",20.36,"hay"
"K3463","09 Jun 2024",15.91," hay "
"H9517","06-09-2024",21.77,"silage "
"V3948","09 Jun 2024",20.87," silage"
"V7756","2024-06-09",17.29,"Silage"
"G2757","09 Jun 2024",20.68,"silage"
"P3832","2024-06-09",22.24,"corn silage"
"Q711","06-09-2024",23.18,"silage "
"V9643","06-09-2024",19.36,"silge"
"R5369","09 Jun 2024",19.72,"hay"
"Q3500","2024-06-09",19.74,"hay"
"B3068","2024-06-09",24.32," hay "
"D8719","2024-06-09",23.38,"Hay"
"M4054","2024-06-09",22.5,"corn silage"
"E9760","06-09-2024",19.14,"silge"
"V472","2024-06-09",21.12,"silage"
"S6097","2024-06-09",21.21,"silge"
"O6552","06-10-2024",16.87,"hay"
"S5427","06-10-2024",14.82," hay "
"N9197","10 Jun 2024",21.93,"Silage"
"C7126","10 Jun 2024",15.41," silage"
"J9639","06-10-2024",20.01,"silge"
"R3357","06-10-2024",20.75," hay "
"V3979","06-10-2024",21.69,"hay"
"K9325","10 Jun 2024",20.57," hay "
"E3229","10 Jun 2024",17.8," hay "
"T5602","10 Jun 2024",22.96,"Hay"
"N9692","10 Jun 2024",25.22,"corn silage"
"V4575","10 Jun 2024",22.64," hay "
"Y3782","10 Jun 2024",14.17,"silage"
"Z7830","06-10-2024",24.2,"silge"
"E5966","06-10-2024",19.83,"silage "
"S9300","2024-06-10",21.57,"silage "
"Y7815","10 Jun 2024",21.87," hay "
"Y9266","2024-06-10",19.71," hay "
"I1385","06/10/2024",19.77,"silage"
"C4705","06-10-2024",23.06,"hay"
"H2377","2024-06-10",22.13,"Silage"
"Z4043","06-10-2024",22.97,"silge"
"G685","2024-06-10",27.15,"Hay"
"J6077","10 Jun 2024",NA,"corn silage"
"I5026","06-10-2024",20.62,"silage "
"S6386","10 Jun 2024",13.37,"hay"
"D9038","06-10-2024",28.08,"hay"
"N7280","06/10/2024",18.55,"Hay"
"Q9174","2024-06-10",27.12,"silage"
"K4714","06/10/2024",21.12,"Hay"
"G150","06-10-2024",24.62," hay "
"U6809","06-10-2024",19.67," hay "
"L9829","10 Jun 2024",21.53,"Hay"
"O8173","06-10-2024",20.64,"Hay"
"J6910","2024-06-10",19.44,"Silage"
"M2207","2024-06-10",19.64," hay "
"G1028","06/10/2024",23.04,"Hay"
"I8517","2024-06-10",19.4,"silage"
"I7447","10 Jun 2024",13.89,"hay"
"J7734","06-10-2024",19.41,"hay"
"W8010","06/10/2024",21.62," silage"
"U1955","06-10-2024",21.85,"Hay"
"G8171","06/10/2024",21.85," silage"
"U5357","06/10/2024",14.92,"silage"
"F5883","10 Jun 2024",21.11," silage"
"Y4092","06-10-2024",22.9,"silage "
"B984","10 Jun 2024",23.83,"hay"
"E6182","10 Jun 2024",19.33,"corn silage"
"H985","06/10/2024",19.03,"silage"
"L4232","06/10/2024",24.46," hay "
"M1583","06/10/2024",NA,"silage"
"R4684","2024-06-10",18.69,"Hay"
"A7863","10 Jun 2024",21.37," hay "
"Y4775","06/10/2024",15.15,"silage"
"Y6643","2024-06-10",20.84,"corn silage"
"F9953","06-10-2024",25.63,"hay"
"U8535","2024-06-10",19.99," silage"
"O7477","10 Jun 2024",19.16,"silage "
"I2506","2024-06-10",21.42,"Silage"
"O194","06-10-2024",19.16,"hay"
"Z3123","10 Jun 2024",22.44," hay "
"P6677","2024-06-10",22.71," hay "
"T4649","2024-06-10",20.01," hay "
"F2131","10 Jun 2024",16.47," hay "
"K3463","06-10-2024",16.05,"hay"
"H9517","2024-06-10",18.22," silage"
"V3948","06/10/2024",22.39,"silage "
"V7756","06/10/2024",14.13,"Silage"
"G2757","2024-06-10",14.34,"silage"
"P3832","06/10/2024",18.04,"silage "
"Q711","06/10/2024",21.18,"silage"
"V9643","2024-06-10",17.26,"corn silage"
"R5369","10 Jun 2024",22.66," hay "
"Q3500","06/10/2024",21,"Hay"
"B3068","10 Jun 2024",19.49," hay "
"D8719","10 Jun 2024",22.46," hay "
"M4054","06-10-2024",21.17," silage"
"E9760","10 Jun 2024",18.66," silage"
"V472","2024-06-10",20.69,"Silage"
"S6097","06/10/2024",21.94,"silge"
"O6552","06/11/2024",21.07,"Hay"
"S5427","06-11-2024",18.03,"hay"
"N9197","11 Jun 2024",22.57,"silage "
"C7126","2024-06-11",23.46," silage"
"J9639","06-11-2024",20.83,"silage"
"R3357","2024-06-11",20.43,"hay"
"V3979","06-11-2024",19.77,"hay"
"K9325","11 Jun 2024",26.48," hay "
"E3229","06/11/2024",20.83,"Hay"
"T5602","2024-06-11",19.53,"hay"
"N9692","06/11/2024",12.48," silage"
"V4575","11 Jun 2024",15.3," hay "
"Y3782","06/11/2024",19.77,"silge"
"Z7830","06-11-2024",20.62,"Silage"
"E5966","11 Jun 2024",20.83,"silage "
"S9300","2024-06-11",22.46," silage"
"Y7815","06/11/2024",19.42,"hay"
"Y9266","2024-06-11",23.64,"hay"
"I1385","06/11/2024",17.24,"silage"
"C4705","2024-06-11",16.37," hay "
"H2377","11 Jun 2024",16.31," silage"
"Z4043","11 Jun 2024",22.23,"Silage"
"G685","06-11-2024",19.75," hay "
"J6077","06-11-2024",22.37,"silage "
"I5026","2024-06-11",19.2,"corn silage"
"S6386","11 Jun 2024",18.22,"Hay"
"D9038","06-11-2024",18.89," hay "
"N7280","2024-06-11",14.44,"hay"
"Q9174","2024-06-11",16.49,"silage"
"K4714","11 Jun 2024",15.67," hay "
"G150","06-11-2024",23.16,"Hay"
"U6809","06-11-2024",18.21,"hay"
"L9829","06/11/2024",22.37,"hay"
"O8173","06/11/2024",24.55,"Hay"
"J6910","06-11-2024",19.42,"corn silage"
"M2207","11 Jun 2024",20.85,"hay"
"G1028","06-11-2024",14.75,"hay"
"I8517","06/11/2024",17.54,"Silage"
"I7447","2024-06-11",20.17," hay "
"J7734","2024-06-11",20.9," hay "
"W8010","06/11/2024",17.72," silage"
"U1955","11 Jun 2024",28.05,"hay"
"G8171","06/11/2024",18.62," silage"
"U5357","06-11-2024",20.19,"silage"
"F5883","06/11/2024",21.95,"silage "
"Y4092","06-11-2024",19.92,"silage"
"B984","06/11/2024",18.07," hay "
"E6182","11 Jun 2024",23.14,"silage "
"H985","2024-06-11",24.85,"silge"
"L4232","06-11-2024",19.91," hay "
"M1583","11 Jun 2024",21.69,"silage"
"R4684","06/11/2024",19.71,"Hay"
"A7863","11 Jun 2024",23.05,"hay"
"Y4775","06-11-2024",16.53,"Silage"
"Y6643","11 Jun 2024",26.96,"corn silage"
"F9953","11 Jun 2024",18.19,"hay"
"U8535","2024-06-11",15.62,"silage "
"O7477","2024-06-11",18.95,"Silage"
"I2506","06-11-2024",20.44,"silage"
"O194","11 Jun 2024",24.87,"Hay"
"Z3123","2024-06-11",22.73,"Hay"
"P6677","2024-06-11",20.43," hay "
"T4649","06/11/2024",15.83," hay "
"F2131","11 Jun 2024",17.4,"hay"
"K3463","2024-06-11",19.51,"hay"
"H9517","06-11-2024",27.66,"silage"
"V3948","11 Jun 2024",14.42,"corn silage"
"V7756","2024-06-11",23.39," silage"
"G2757","2024-06-11",18.42,"Silage"
"P3832","11 Jun 2024",25,"silge"
"Q711","2024-06-11",16.58,"silage"
"V9643","2024-06-11",20.43,"silage"
"R5369","06-11-2024",16.7,"hay"
"Q3500","06/11/2024",22.71," hay "
"B3068","11 Jun 2024",24.45,"hay"
"D8719","06/11/2024",25.85,"hay"
"M4054","2024-06-11",22.39,"Silage"
"E9760","11 Jun 2024",25.53,"silage "
"V472","2024-06-11",23.74,"corn silage"
"S6097","06/11/2024",19.6,"silage "
"O6552","06/12/2024",21.43,"Hay"
"S5427","06-12-2024",17.08,"Hay"
"N9197","12 Jun 2024",19.44,"Silage"
"C7126","2024-06-12",23.66,"Silage"
"J9639","2024-06-12",21.62,"silge"
"R3357","06/12/2024",21.37,"hay"
"V3979","06-12-2024",16.89," hay "
"K9325","06/12/2024",18.19,"Hay"
"E3229","2024-06-12",17.71," hay "
"T5602","06/12/2024",21.19,"Hay"
"N9692","06/12/2024",17.03," silage"
"V4575","06/12/2024",21.69,"Hay"
"Y3782","2024-06-12",16.65,"silage "
"Z7830","2024-06-12",25.49,"Silage"
"E5966","06/12/2024",21.38,"corn silage"
"S9300","12 Jun 2024",17.9,"Silage"
"Y7815","06-12-2024",20.72," hay "
"Y9266","2024-06-12",18.94,"Hay"
"I1385","06-12-2024",21.11,"silge"
"C4705","2024-06-12",20.73," hay "
"H2377","06/12/2024",16.96,"Silage"
"Z4043","2024-06-12",17.63,"Silage"
"G685","06/12/2024",20.9,"Hay"
"J6077","06/12/2024",24.92,"Silage"
"I5026","2024-06-12",23.25,"corn silage"
"S6386","06-12-2024",18.13,"hay"
"D9038","2024-06-12",22.48," hay "
"N7280","06/12/2024",19.85," hay "
"Q9174","12 Jun 2024",20.9,"silage "
"K4714","06-12-2024",20.78,"hay"
"G150","12 Jun 2024",27.73," hay "
"U6809","06-12-2024",16.44," hay "
"L9829","06-12-2024",20.3," hay "
"O8173","2024-06-12",14.66," hay "
"J6910","12 Jun 2024",21.77,"Silage"
"M2207","12 Jun 2024",23.29,"Hay"
"G1028","06/12/2024",24.34," hay "
"I8517","12 Jun 2024",14.22,"silage"
"I7447","06/12/2024",21.24,"Hay"
"J7734","12 Jun 2024",24.78," hay "
"W8010","06-12-2024",18.76,"silge"
"U1955","06-12-2024",19.36," hay "
"G8171","06/12/2024",19.89,"silage "
"U5357","12 Jun 2024",21.1," silage"
"F5883","06/12/2024",22,"corn silage"
"Y4092","12 Jun 2024",23.95,"silage"
"B984","12 Jun 2024",19.71,"hay"
"E6182","12 Jun 2024",20.59," silage"
"H985","2024-06-12",27.46,"silage "
"L4232","06/12/2024",21.29," hay "
"M1583","2024-06-12",20.57,"silage"
"R4684","12 Jun 2024",15.97,"Hay"
"A7863","06/12/2024",20.01,"Hay"
"Y4775","06-12-2024",19.34,"silage "
"Y6643","12 Jun 2024",19.97,"silage "
"F9953","06/12/2024",18.27,"Hay"
"U8535","06-12-2024",17.94,"silge"
"O7477","2024-06-12",17.84,"corn silage"
"I2506","12 Jun 2024",19.36," silage"
"O194","06/12/2024",24.1,"Hay"
"Z3123","2024-06-12",23.15," hay "
"P6677","2024-06-12",18.92," hay "
"T4649","2024-06-12",14.94," hay "
"F2131","06-12-2024",17.47," hay "
"K3463","12 Jun 2024",18.63,"hay"
"H9517","2024-06-12",20.31," silage"
"V3948","06/12/2024",18.01,"silage "
"V7756","2024-06-12",26.02,"Silage"
"G2757","2024-06-12",19.18,"corn silage"
"P3832","12 Jun 2024",16.36," silage"
"Q711","12 Jun 2024",19.58,"silage "
"V9643","12 Jun 2024",16.98,"Silage"
"R5369","12 Jun 2024",20.47," hay "
"Q3500","06/12/2024",20.7," hay "
"B3068","2024-06-12",21.07," hay "
"D8719","06/12/2024",15.13,"hay"
"M4054","2024-06-12",20.66,"silage "
"E9760","06-12-2024",20.93," silage"
"V472","12 Jun 2024",15.74,"silge"
"S6097","12 Jun 2024",22.87," silage"
"O6552","13 Jun 2024",22.35,"hay"
"S5427","2024-06-13",26.9," hay "
"N9197","06/13/2024",20.47,"Silage"
"C7126","2024-06-13",20.14,"silge"
"J9639","06-13-2024",20.29,"Silage"
"R3357","06/13/2024",20.21,"Hay"
"V3979","06/13/2024",14.45,"Hay"
"K9325","06-13-2024",14.99,"hay"
"E3229","13 Jun 2024",19.77,"hay"
"T5602","06-13-2024",18.26,"Hay"
"N9692","06/13/2024",20.16,"silage "
"V4575","06/13/2024",13.67,"hay"
"Y3782","2024-06-13",15.5,"Silage"
"Z7830","06/13/2024",16.7,"silage "
"E5966","06/13/2024",22.96," silage"
"S9300","13 Jun 2024",16.7,"Silage"
"Y7815","06-13-2024",17.6,"hay"
"Y9266","2024-06-13",20.24,"hay"
"I1385","06-13-2024",19.03,"silage"
"C4705","13 Jun 2024",20.44,"Hay"
"H2377","06-13-2024",26.92,"corn silage"
"Z4043","06-13-2024",16.63,"silage "
"G685","06/13/2024",19.08," hay "
"J6077","2024-06-13",18.45," silage"
"I5026","06-13-2024",24.54,"silage"
"S6386","13 Jun 2024",17.69,"Hay"
"D9038","06/13/2024",19.75,"hay"
"N7280","2024-06-13",22.36," hay "
"Q9174","06-13-2024",16.82,"silage"
"K4714","06/13/2024",24.97,"Hay"
"G150","06-13-2024",22.03," hay "
"U6809","13 Jun 2024",16.78,"Hay"
"L9829","2024-06-13",21.36,"Hay"
"O8173","13 Jun 2024",19.36,"hay"
"J6910","2024-06-13",20.94,"silge"
"M2207","06/13/2024",19.73,"Hay"
"G1028","2024-06-13",23.21,"Hay"
"I8517","06/13/2024",15.95," silage"
"I7447","06-13-2024",18.43,"Hay"
"J7734","13 Jun 2024",19.25,"hay"
"W8010","06/13/2024",17.01,"silage "
"U1955","2024-06-13",16.88,"hay"
"G8171","06/13/2024",19.95,"silage "
"U5357","06-13-2024",19.6,"silage"
"F5883","06-13-2024",12.35,"silage "
"Y4092","06/13/2024",23.12,"Silage"
"B984","06-13-2024",20.75," hay "
"E6182","06-13-2024",27.25,"Silage"
"H985","13 Jun 2024",22.06," silage"
"L4232","2024-06-13",18.66,"hay"
"M1583","06-13-2024",28.39," silage"
"R4684","06/13/2024",28.5,"hay"
"A7863","13 Jun 2024",16.34," hay "
"Y4775","06/13/2024",21.41," silage"
"Y6643","06/13/2024",19.37,"corn silage"
"F9953","06-13-2024",20.56,"Hay"
"U8535","2024-06-13",20.68,"silage"
"O7477","06-13-2024",16.21," silage"
"I2506","06/13/2024",20.86,"corn silage"
"O194","13 Jun 2024",25.25," hay "
"Z3123","06/13/2024",19.51," hay "
"P6677","06-13-2024",19.51,"hay"
"T4649","06/13/2024",24.2,"Hay"
"F2131","06/13/2024",22.7," hay "
"K3463","13 Jun 2024",15.05,"hay"
"H9517","2024-06-13",NA,"silage "
"V3948","06-13-2024",24.96,"silge"
"V7756","13 Jun 2024",24.25,"silage "
"G2757","13 Jun 2024",21.26,"corn silage"
"P3832","06-13-2024",22.16,"corn silage"
"Q711","06/13/2024",16.41,"Silage"
"V9643","06-13-2024",20.9,"silage "
"R5369","06/13/2024",17.14,"Hay"
"Q3500","2024-06-13",18.63," hay "
"B3068","06/13/2024",22.81,"hay"
"D8719","06-13-2024",16.59,"Hay"
"M4054","13 Jun 2024",20.8,"corn silage"
"E9760","2024-06-13",21.28," silage"
"V472","06/13/2024",20.16,"silage"
"S6097","2024-06-13",25.47,"silge"
"O6552","06-14-2024",16.93,"hay"
"S5427","2024-06-14",21.82,"hay"
"N9197","06-14-2024",19.73," silage"
"C7126","06/14/2024",19.22," silage"
"J9639","06/14/2024",21.39,"silge"
"R3357","06-14-2024",16.94," hay "
"V3979","06-14-2024",16.06," hay "
"K9325","06/14/2024",18.52," hay "
"E3229","06-14-2024",25.26," hay "
"T5602","2024-06-14",20.17," hay "
"N9692","14 Jun 2024",20.99," silage"
"V4575","14 Jun 2024",19.43,"Hay"
"Y3782","06/14/2024",21.41,"Silage"
"Z7830","06/14/2024",17.14,"silage"
"E5966","06-14-2024",23.47,"corn silage"
"S9300","06-14-2024",21.75," silage"
"Y7815","06/14/2024",17.58,"hay"
"Y9266","2024-06-14",20.16," hay "
"I1385","14 Jun 2024",22.15," silage"
"C4705","2024-06-14",21.67," hay "
"H2377","2024-06-14",24.45,"silage "
"Z4043","2024-06-14",18.16,"silage "
"G685","06/14/2024",23.35,"Hay"
"J6077","06-14-2024",23.11," silage"
"I5026","14 Jun 2024",19.51,"corn silage"
"S6386","2024-06-14",17.07," hay "
"D9038","2024-06-14",16.73,"hay"
"N7280","14 Jun 2024",21.37,"hay"
"Q9174","14 Jun 2024",19.79,"silge"
"K4714","14 Jun 2024",25.34,"hay"
"G150","14 Jun 2024",21.61,"hay"
"U6809","06/14/2024",18.88,"Hay"
"L9829","2024-06-14",16.92,"Hay"
"O8173","2024-06-14",18.25," hay "
"J6910","06/14/2024",21.03,"corn silage"
"M2207","06-14-2024",18.65,"hay"
"G1028","06-14-2024",21.54,"Hay"
"I8517","14 Jun 2024",19," silage"
"I7447","14 Jun 2024",19.68," hay "
"J7734","06-14-2024",17.81," hay "
"W8010","14 Jun 2024",25.72,"silage "
"U1955","2024-06-14",21,"Hay"
"G8171","06/14/2024",20.69," silage"
"U5357","06/14/2024",14.92,"Silage"
"F5883","06/14/2024",21.98,"Silage"
"Y4092","14 Jun 2024",16.93," silage"
"B984","14 Jun 2024",17.33,"Hay"
"E6182","06-14-2024",22.76,"Silage"
"H985","06/14/2024",18.64," silage"
"L4232","2024-06-14",14.75,"hay"
"M1583","06-14-2024",25.31,"silage "
"R4684","06/14/2024",12.87," hay "
"A7863","06-14-2024",21.72,"hay"
"Y4775","14 Jun 2024",23.05," silage"
"Y6643","2024-06-14",18.11,"silage"
"F9953","14 Jun 2024",21.33," hay "
"U8535","06-14-2024",21.32,"corn silage"
"O7477","06-14-2024",23.12,"silage "
"I2506","06/14/2024",21.45,"silage "
"O194","14 Jun 2024",19.27," hay "
"Z3123","2024-06-14",22.75,"Hay"
"P6677","2024-06-14",22.4,"hay"
"T4649","06/14/2024",17.19," hay "
"F2131","06-14-2024",15.8,"hay"
"K3463","06-14-2024",20.48,"Hay"
"H9517","06-14-2024",19.18,"corn silage"
"V3948","14 Jun 2024",17.04,"corn silage"
"V7756","06-14-2024",20.25," silage"
"G2757","2024-06-14",16.04," silage"
"P3832","06/14/2024",20.48,"corn silage"
"Q711","06-14-2024",18.13,"silage "
"V9643","06/14/2024",22.87,"silge"
"R5369","14 Jun 2024",27.27," hay "
"Q3500","06/14/2024",17.25," hay "
"B3068","06-14-2024",23.17,"Hay"
"D8719","2024-06-14",22.48,"Hay"
"M4054","06/14/2024",19.79,"silage "
"E9760","14 Jun 2024",18.64,"corn silage"
"V472","2024-06-14",24.73,"silge"
"S6097","06/14/2024",13.98,"silge"
"O6552","06-15-2024",18.07," hay "
"S5427","06-15-2024",15.69," hay "
"N9197","06-15-2024",24.19,"Silage"
"C7126","06-15-2024",19.43,"silge"
"J9639","15 Jun 2024",18.43,"silage"
"R3357","2024-06-15",29.55,"hay"
"V3979","06/15/2024",19.85," hay "
"K9325","06/15/2024",18.67,"hay"
"E3229","15 Jun 2024",20.9," hay "
"T5602","15 Jun 2024",15.29,"hay"
"N9692","2024-06-15",NA," silage"
"V4575","2024-06-15",19.71,"Hay"
"Y3782","15 Jun 2024",21.41,"corn silage"
"Z7830","2024-06-15",17.05,"silge"
"E5966","15 Jun 2024",16.93,"Silage"
"S9300","2024-06-15",17.92,"corn silage"
"Y7815","06/15/2024",17.7,"hay"
"Y9266","06-15-2024",23.9," hay "
"I1385","06-15-2024",24.74,"silage"
"C4705","06/15/2024",19.53,"hay"
"H2377","15 Jun 2024",18.92," silage"
"Z4043","15 Jun 2024",19.01," silage"
"G685","2024-06-15",20.21,"Hay"
"J6077","06-15-2024",20.29,"silage"
"I5026","06/15/2024",20.87,"silage"
"S6386","15 Jun 2024",17.76,"hay"
"D9038","15 Jun 2024",17.46,"hay"
"N7280","2024-06-15",23.59,"hay"
"Q9174","06/15/2024",18.35,"silage "
"K4714","2024-06-15",20.91," hay "
"G150","2024-06-15",19.83,"Hay"
"U6809","06/15/2024",17.13," hay "
"L9829","2024-06-15",21.77,"Hay"
"O8173","06-15-2024",20.52," hay "
"J6910","06/15/2024",24.2,"Silage"
"M2207","15 Jun 2024",20.35,"hay"
"G1028","2024-06-15",19.01," hay "
"I8517","2024-06-15",20.83," silage"
"I7447","06/15/2024",16.44,"Hay"
"J7734","2024-06-15",17.49,"hay"
"W8010","06/15/2024",21.53,"Silage"
"U1955","15 Jun 2024",19," hay "
"G8171","2024-06-15",19.8,"Silage"
"U5357","15 Jun 2024",19.65," silage"
"F5883","15 Jun 2024",18.05,"corn silage"
"Y4092","2024-06-15",13.94,"Silage"
"B984","15 Jun 2024",21.05," hay "
"E6182","06/15/2024",22.28,"silage"
"H985","06-15-2024",16.13," silage"
"L4232","2024-06-15",24.45," hay "
"M1583","06/15/2024",21.16,"silge"
"R4684","06/15/2024",24.02,"hay"
"A7863","2024-06-15",17.13,"Hay"
"Y4775","2024-06-15",20.5,"silage"
"Y6643","06/15/2024",19.7,"silage"
"F9953","06-15-2024",22.31," hay "
"U8535","15 Jun 2024",18.27,"corn silage"
"O7477","06-15-2024",19.97,"silge"
"I2506","2024-06-15",14.66,"Silage"
"O194","15 Jun 2024",17.67," hay "
"Z3123","06/15/2024",20.38," hay "
"P6677","15 Jun 2024",17.88,"Hay"
"T4649","06/15/2024",19.87,"Hay"
"F2131","2024-06-15",18.6,"Hay"
"K3463","06-15-2024",21.82," hay "
"H9517","06-15-2024",23.51," silage"
"V3948","06-15-2024",17.53,"Silage"
"V7756","2024-06-15",19.08,"corn silage"
"G2757","06/15/2024",24.32," silage"
"P3832","2024-06-15",13.4,"corn silage"
"Q711","2024-06-15",19.04,"Silage"
"V9643","06-15-2024",26.19,"silage"
"R5369","06/15/2024",26.58,"hay"
"Q3500","06/15/2024",20.47," hay "
"B3068","15 Jun 2024",17.41,"Hay"
"D8719","2024-06-15",20.5," hay "
"M4054","15 Jun 2024",18.04," silage"
"E9760","2024-06-15",24.36,"silage "
"V472","06/15/2024",17.58,"corn silage"
"S6097","2024-06-15",21.12,"Silage"
"O6552","16 Jun 2024",21.86,"Hay"
"S5427","2024-06-16",17.73,"Hay"
"N9197","16 Jun 2024",22.55,"Silage"
"C7126","2024-06-16",17.76,"silage"
"J9639","06/16/2024",21.89,"silge"
"R3357","06-16-2024",23.29,"hay"
"V3979","06/16/2024",17.03," hay "
"K9325","2024-06-16",23.32,"Hay"
"E3229","06-16-2024",18.53," hay "
"T5602","06-16-2024",20.88,"hay"
"N9692","06-16-2024",20.61,"Silage"
"V4575","06/16/2024",18.72,"Hay"
"Y3782","06-16-2024",20.8," silage"
"Z7830","2024-06-16",16.31,"silage"
"E5966","16 Jun 2024",19.59,"corn silage"
"S9300","06/16/2024",22.48,"silage"
"Y7815","16 Jun 2024",13.48,"hay"
"Y9266","2024-06-16",15.54,"Hay"
"I1385","2024-06-16",16.51,"silage "
"C4705","16 Jun 2024",15.23,"Hay"
"H2377","06/16/2024",21.26,"silage"
"Z4043","2024-06-16",17.02,"silge"
"G685","06-16-2024",13.51,"hay"
"J6077","2024-06-16",18.09,"corn silage"
"I5026","06-16-2024",18.83,"silge"
"S6386","06/16/2024",22.57,"Hay"
"D9038","06/16/2024",16.69,"Hay"
"N7280","06/16/2024",NA,"Hay"
"Q9174","16 Jun 2024",21.2,"silage "
"K4714","2024-06-16",21.09," hay "
"G150","06-16-2024",17.44,"hay"
"U6809","06-16-2024",25.86," hay "
"L9829","16 Jun 2024",19.51," hay "
"O8173","06-16-2024",14.53," hay "
"J6910","06/16/2024",19.39,"silage"
"M2207","2024-06-16",14.2," hay "
"G1028","2024-06-16",19.07,"Hay"
"I8517","06/16/2024",18.73,"silge"
"I7447","06-16-2024",22.05,"Hay"
"J7734","06/16/2024",23.03," hay "
"W8010","2024-06-16",17.82,"Silage"
"U1955","06-16-2024",22.42,"hay"
"G8171","06-16-2024",24.27,"corn silage"
"U5357","2024-06-16",17.65,"silage "
"F5883","06/16/2024",18.04,"silage"
"Y4092","2024-06-16",21.95,"silage"
"B984","06-16-2024",20.55,"hay"
"E6182","06-16-2024",21.65,"silage"
"H985","06-16-2024",24.21,"Silage"
"L4232","06-16-2024",21.16,"hay"
"M1583","2024-06-16",23.16,"silage"
"R4684","2024-06-16",21.87,"Hay"
"A7863","16 Jun 2024",21.3,"Hay"
"Y4775","06-16-2024",21.16,"silge"
"Y6643","06/16/2024",23.87," silage"
"F9953","2024-06-16",16.99,"Hay"
"U8535","06/16/2024",16.68,"silage "
"O7477","06-16-2024",21.78,"Silage"
"I2506","16 Jun 2024",19.64," silage"
"O194","06/16/2024",20.22,"hay"
"Z3123","16 Jun 2024",22.22,"Hay"
"P6677","06-16-2024",22.26,"hay"
"T4649","2024-06-16",19.21,"hay"
"F2131","06-16-2024",19.06,"Hay"
"K3463","06/16/2024",20.22," hay "
"H9517","06/16/2024",23.19,"Silage"
"V3948","2024-06-16",21.28,"silage"
"V7756","06-16-2024",24.3," silage"
"G2757","16 Jun 2024",19.98,"silage"
"P3832","06/16/2024",23.38," silage"
"Q711","2024-06-16",22.65,"Silage"
"V9643","16 Jun 2024",21.84,"silage"
"R5369","06-16-2024",21.24," hay "
"Q3500","2024-06-16",19.16,"hay"
"B3068","06-16-2024",19.67," hay "
"D8719","16 Jun 2024",20.69,"hay"
"M4054","16 Jun 2024",20.15,"silge"
"E9760","06-16-2024",22.83,"silage"
"V472","06/16/2024",19.67,"silge"
"S6097","06/16/2024",19.79,"Silage"
"O6552","17 Jun 2024",18.55,"Hay"
"S5427","17 Jun 2024",19.58,"hay"
"N9197","06-17-2024",19.79,"silage "
"C7126","2024-06-17",13.06,"corn silage"
"J9639","06/17/2024",15.91,"silage "
"R3357","17 Jun 2024",19.78,"hay"
"V3979","2024-06-17",19.2," hay "
"K9325","06-17-2024",16.4,"hay"
"E3229","06-17-2024",14.03,"hay"
"T5602","06/17/2024",18.94,"Hay"
"N9692","06-17-2024",21.96,"silge"
"V4575","06/17/2024",25.32," hay "
"Y3782","06/17/2024",19.88,"silge"
"Z7830","06/17/2024",24.48,"silge"
"E5966","17 Jun 2024",20.25," silage"
"S9300","2024-06-17",20.35,"corn silage"
"Y7815","06-17-2024",20.97,"hay"
"Y9266","2024-06-17",17.39," hay "
"I1385","06/17/2024",19.84,"silage"
"C4705","06/17/2024",22.73," hay "
"H2377","2024-06-17",17.75," silage"
"Z4043","06-17-2024",19.04," silage"
"G685","2024-06-17",16.56,"Hay"
"J6077","2024-06-17",21.06,"silge"
"I5026","06-17-2024",21.27,"corn silage"
"S6386","2024-06-17",21.95,"Hay"
"D9038","2024-06-17",16.34,"Hay"
"N7280","06-17-2024",20.32,"hay"
"Q9174","06/17/2024",17.17,"corn silage"
"K4714","17 Jun 2024",20," hay "
"G150","17 Jun 2024",24.03,"hay"
"U6809","06-17-2024",18.49,"hay"
"L9829","06/17/2024",22.15,"hay"
"O8173","2024-06-17",17.75," hay "
"J6910","2024-06-17",18.56,"Silage"
"M2207","2024-06-17",21.32," hay "
"G1028","2024-06-17",17.96,"hay"
"I8517","2024-06-17",14.89,"Silage"
"I7447","06/17/2024",23.8," hay "
"J7734","06-17-2024",21.08,"Hay"
"W8010","06-17-2024",18.25,"silge"
"U1955","17 Jun 2024",14.02,"Hay"
"G8171","17 Jun 2024",25.71,"silage"
"U5357","17 Jun 2024",30.17,"silage "
"F5883","06/17/2024",20.62,"corn silage"
"Y4092","2024-06-17",22.55,"corn silage"
"B984","2024-06-17",23.67,"Hay"
"E6182","06/17/2024",17.89,"silage"
"H985","06/17/2024",18.95,"silage"
"L4232","2024-06-17",14.82,"hay"
"M1583","17 Jun 2024",17.79,"corn silage"
"R4684","2024-06-17",21.87,"Hay"
"A7863","06/17/2024",19.13," hay "
"Y4775","06-17-2024",19.36,"silge"
"Y6643","2024-06-17",19.66,"silage "
"F9953","06-17-2024",14.41,"Hay"
"U8535","17 Jun 2024",22.51,"silge"
"O7477","06-17-2024",15.67,"silage"
"I2506","17 Jun 2024",19.37,"silge"
"O194","2024-06-17",18.68,"Hay"
"Z3123","06-17-2024",19.34,"hay"
"P6677","17 Jun 2024",24.38,"Hay"
"T4649","2024-06-17",18.25,"Hay"
"F2131","06-17-2024",17.65,"hay"
"K3463","17 Jun 2024",15.44,"Hay"
"H9517","17 Jun 2024",17.58,"silage"
"V3948","17 Jun 2024",16.5,"corn silage"
"V7756","17 Jun 2024",21.22,"Silage"
"G2757","17 Jun 2024",NA,"silge"
"P3832","2024-06-17",20.91,"silage "
"Q711","06/17/2024",19.56,"corn silage"
"V9643","2024-06-17",15.7," silage"
"R5369","06/17/2024",17.63,"Hay"
"Q3500","06/17/2024",22.66," hay "
"B3068","06/17/2024",22.71,"Hay"
"D8719","06-17-2024",26.02,"Hay"
"M4054","06/17/2024",19.99,"Silage"
"E9760","06-17-2024",15.51,"silage"
"V472","2024-06-17",17.69,"corn silage"
"S6097","06-17-2024",21.23,"silage"
"O6552","18 Jun 2024",25.7," hay "
"S5427","06-18-2024",20.33," hay "
"N9197","06-18-2024",23.42,"silge"
"C7126","06/18/2024",22.3,"corn silage"
"J9639","18 Jun 2024",16.5,"silage "
"R3357","06/18/2024",19.49,"Hay"
"V3979","18 Jun 2024",23.92,"hay"
"K9325","06-18-2024",22.63," hay "
"E3229","18 Jun 2024",21.39," hay "
"T5602","18 Jun 2024",21.43,"Hay"
"N9692","06/18/2024",18.53,"silage"
"V4575","2024-06-18",16.04,"hay"
"Y3782","18 Jun 2024",23.89,"silage"
"Z7830","06-18-2024",15.74,"corn silage"
"E5966","06-18-2024",17.18,"corn silage"
"S9300","18 Jun 2024",21.89," silage"
"Y7815","06/18/2024",16.21,"hay"
"Y9266","06/18/2024",18.34,"Hay"
"I1385","18 Jun 2024",16.45,"silge"
"C4705","2024-06-18",21.86,"hay"
"H2377","2024-06-18",21.34,"silge"
"Z4043","06-18-2024",21.27,"Silage"
"G685","18 Jun 2024",21.33,"hay"
"J6077","06/18/2024",21.67,"corn silage"
"I5026","18 Jun 2024",21.92," silage"
"S6386","06/18/2024",14.09," hay "
"D9038","06/18/2024",19.55,"Hay"
"N7280","06-18-2024",20.34,"hay"
"Q9174","06-18-2024",22.17,"silage "
"K4714","06-18-2024",16.44," hay "
"G150","2024-06-18",18.5," hay "
"U6809","18 Jun 2024",16.78," hay "
"L9829","18 Jun 2024",23.17," hay "
"O8173","06/18/2024",23.84," hay "
"J6910","18 Jun 2024",22.36,"corn silage"
"M2207","2024-06-18",16.33," hay "
"G1028","18 Jun 2024",21.36," hay "
"I8517","18 Jun 2024",23.45,"silage"
"I7447","2024-06-18",20.5,"hay"
"J7734","18 Jun 2024",18.3,"Hay"
"W8010","06/18/2024",16.74,"Silage"
"U1955","18 Jun 2024",18,"hay"
"G8171","18 Jun 2024",22.14,"corn silage"
"U5357","18 Jun 2024",18.71,"silge"
"F5883","06-18-2024",20.68,"silage "
"Y4092","06/18/2024",23.88," silage"
"B984","18 Jun 2024",21.74,"hay"
"E6182","18 Jun 2024",24.09,"silage"
"H985","06/18/2024",14.9," silage"
"L4232","06/18/2024",19.16,"hay"
"M1583","18 Jun 2024",20.2,"silage "
"R4684","2024-06-18",21.74," hay "
"A7863","06-18-2024",16.49,"hay"
"Y4775","2024-06-18",22.42,"silage "
"Y6643","18 Jun 2024",20.92,"silge"
"F9953","2024-06-18",20.79," hay "
"U8535","18 Jun 2024",21.53," silage"
"O7477","06/18/2024",19.65,"silge"
"I2506","06/18/2024",22.78,"corn silage"
"O194","2024-06-18",21.94,"hay"
"Z3123","06-18-2024",19.55,"Hay"
"P6677","2024-06-18",23.12,"Hay"
"T4649","2024-06-18",20.88,"hay"
"F2131","06/18/2024",22.01,"Hay"
"K3463","06/18/2024",18.22,"hay"
"H9517","06-18-2024",24.74,"Silage"
"V3948","2024-06-18",19.99,"silage "
"V7756","06/18/2024",22.54,"silge"
"G2757","06-18-2024",19.7," silage"
"P3832","06/18/2024",19.16,"corn silage"
"Q711","06-18-2024",22.35,"silge"
"V9643","2024-06-18",15.25,"silage "
"R5369","18 Jun 2024",21.44,"Hay"
"Q3500","06-18-2024",21.18,"hay"
"B3068","06/18/2024",11.91," hay "
"D8719","18 Jun 2024",21.11,"Hay"
"M4054","2024-06-18",13.49," silage"
"E9760","18 Jun 2024",21.98,"silage"
"V472","06/18/2024",18.64,"silage "
"S6097","2024-06-18",17.92,"silge"
"O6552","06/19/2024",19.98,"hay"
"S5427","2024-06-19",24.12,"hay"
"N9197","2024-06-19",18.09,"silage"
"C7126","06/19/2024",21.67,"Silage"
"J9639","19 Jun 2024",21.02,"corn silage"
"R3357","19 Jun 2024",16.46," hay "
"V3979","06-19-2024",14.78," hay "
"K9325","19 Jun 2024",14.02," hay "
"E3229","06-19-2024",21.65,"hay"
"T5602","06/19/2024",19.9," hay "
"N9692","2024-06-19",25.55,"silge"
"V4575","2024-06-19",21.72,"Hay"
"Y3782","06-19-2024",22.55,"silage "
"Z7830","19 Jun 2024",24,"silage"
"E5966","06-19-2024",18.5,"silage "
"S9300","19 Jun 2024",21.53," silage"
"Y7815","2024-06-19",22.61,"Hay"
"Y9266","19 Jun 2024",24.11,"Hay"
"I1385","06/19/2024",22.29,"corn silage"
"C4705","2024-06-19",21.26,"Hay"
"H2377","06/19/2024",17.4,"corn silage"
"Z4043","2024-06-19",22.19,"Silage"
"G685","2024-06-19",21.5,"Hay"
"J6077","06/19/2024",21.9,"silage"
"I5026","19 Jun 2024",21.27,"silge"
"S6386","06/19/2024",19.39,"hay"
"D9038","06-19-2024",19.77,"Hay"
"N7280","19 Jun 2024",22.06," hay "
"Q9174","19 Jun 2024",20.51,"Silage"
"K4714","06-19-2024",17.51," hay "
"G150","06-19-2024",19.13,"Hay"
"U6809","19 Jun 2024",16.04,"hay"
"L9829","06-19-2024",17.1," hay "
"O8173","06-19-2024",19.57," hay "
"J6910","2024-06-19",14.61,"silge"
"M2207","19 Jun 2024",14.93,"hay"
"G1028","19 Jun 2024",23.31,"Hay"
"I8517","2024-06-19",18.27," silage"
"I7447","06-19-2024",14.44,"hay"
"J7734","06-19-2024",19.66," hay "
"W8010","19 Jun 2024",23.96,"corn silage"
"U1955","06/19/2024",21.99,"hay"
"G8171","06/19/2024",21.32," silage"
"U5357","06/19/2024",23.55,"Silage"
"F5883","06/19/2024",17.69,"Silage"
"Y4092","2024-06-19",22.19,"silage "
"B984","19 Jun 2024",18.24,"hay"
"E6182","2024-06-19",20," silage"
"H985","06/19/2024",26.64,"silage "
"L4232","19 Jun 2024",22.91,"hay"
"M1583","06/19/2024",22.3,"Silage"
"R4684","06/19/2024",16.68," hay "
"A7863","19 Jun 2024",17.64," hay "
"Y4775","06/19/2024",26.85,"silge"
"Y6643","06-19-2024",16.72,"silage"
"F9953","19 Jun 2024",20.64," hay "
"U8535","06-19-2024",22.68,"Silage"
"O7477","19 Jun 2024",23.06,"silge"
"I2506","06/19/2024",23.27,"corn silage"
"O194","06/19/2024",19.51,"Hay"
"Z3123","19 Jun 2024",17.54,"Hay"
"P6677","19 Jun 2024",19.08,"hay"
"T4649","06-19-2024",17.29,"hay"
"F2131","19 Jun 2024",21.88," hay "
"K3463","2024-06-19",23.36,"hay"
"H9517","06-19-2024",26.38," silage"
"V3948","06-19-2024",21.1,"silage"
"V7756","19 Jun 2024",17.38," silage"
"G2757","2024-06-19",23.07," silage"
"P3832","19 Jun 2024",22.71,"silge"
"Q711","2024-06-19",19.29,"silage "
"V9643","19 Jun 2024",15.33,"silage"
"R5369","2024-06-19",22.28," hay "
"Q3500","19 Jun 2024",23.39," hay "
"B3068","06-19-2024",19.11,"hay"
"D8719","06-19-2024",21.61," hay "
"M4054","06/19/2024",19.17,"silge"
"E9760","06/19/2024",22.05,"corn silage"
"V472","06-19-2024",19.65,"silage "
"S6097","2024-06-19",18.97,"silage"
"O6552","06-20-2024",20.33,"hay"
"S5427","20 Jun 2024",19.15," hay "
"N9197","20 Jun 2024",18.23,"Silage"
"C7126","2024-06-20",19.05,"silge"
"J9639","20 Jun 2024",19.98,"silage"
"R3357","20 Jun 2024",20.62,"Hay"
"V3979","06/20/2024",24.6,"hay"
"K9325","06/20/2024",15.93,"hay"
"E3229","06/20/2024",19.4,"Hay"
"T5602","2024-06-20",21.89,"Hay"
"N9692","20 Jun 2024",25.29,"silage"
"V4575","06-20-2024",21.28,"hay"
"Y3782","06/20/2024",19.96,"corn silage"
"Z7830","06-20-2024",19.08,"silge"
"E5966","2024-06-20",21.24,"corn silage"
"S9300","20 Jun 2024",22.97,"silage"
"Y7815","06-20-2024",19.45,"Hay"
"Y9266","20 Jun 2024",20.49,"Hay"
"I1385","20 Jun 2024",20.65," silage"
"C4705","06-20-2024",22.19," hay "
"H2377","06-20-2024",23.33," silage"
"Z4043","2024-06-20",20.84,"silage"
"G685","20 Jun 2024",19.77,"Hay"
"J6077","20 Jun 2024",24.18," silage"
"I5026","2024-06-20",20.49," silage"
"S6386","2024-06-20",24.73,"hay"
"D9038","06-20-2024",19.81,"hay"
"N7280","20 Jun 2024",21.84,"hay"
"Q9174","2024-06-20",15.36,"Silage"
"K4714","2024-06-20",19.66,"Hay"
"G150","2024-06-20",19.93," hay "
"U6809","06-20-2024",17.72," hay "
"L9829","20 Jun 2024",16.89,"hay"
"O8173","2024-06-20",22.84,"Hay"
"J6910","2024-06-20",22.74,"silage "
"M2207","06/20/2024",16.1," hay "
"G1028","06-20-2024",21.27,"hay"
"I8517","20 Jun 2024",16.66,"corn silage"
"I7447","20 Jun 2024",16.85,"Hay"
"J7734","06-20-2024",21.58,"Hay"
"W8010","06-20-2024",17.94,"corn silage"
"U1955","06-20-2024",22.98," hay "
"G8171","06/20/2024",20.12,"silage "
"U5357","20 Jun 2024",21.61,"Silage"
"F5883","2024-06-20",18.43,"silage "
"Y4092","2024-06-20",16.55,"Silage"
"B984","2024-06-20",22.74,"Hay"
"E6182","06-20-2024",20.71,"corn silage"
"H985","06-20-2024",19.28,"corn silage"
"L4232","20 Jun 2024",20.21,"hay"
"M1583","06-20-2024",23.98,"silge"
"R4684","20 Jun 2024",17.91,"hay"
"A7863","06/20/2024",17.75,"hay"
"Y4775","2024-06-20",18.14,"Silage"
"Y6643","2024-06-20",15.25,"Silage"
"F9953","06-20-2024",22.46," hay "
"U8535","06/20/2024",20.58,"silge"
"O7477","20 Jun 2024",20.62,"silage"
"I2506","20 Jun 2024",19.87,"Silage"
"O194","20 Jun 2024",18.47,"Hay"
"Z3123","06/20/2024",17.53,"Hay"
"P6677","06-20-2024",22.56,"hay"
"T4649","06/20/2024",15.72,"Hay"
"F2131","06/20/2024",21.32,"hay"
"K3463","06/20/2024",17.62,"Hay"
"H9517","06/20/2024",20.85,"corn silage"
"V3948","2024-06-20",17.78,"silage "
"V7756","2024-06-20",18.43,"silge"
"G2757","20 Jun 2024",25.31,"silage"
"P3832","06/20/2024",22,"Silage"
"Q711","06/20/2024",13.57,"silage "
"V9643","2024-06-20",20.38," silage"
"R5369","06-20-2024",18.64," hay "
"Q3500","2024-06-20",16.59,"hay"
"B3068","2024-06-20",20.63,"Hay"
"D8719","20 Jun 2024",20.39,"hay"
"M4054","2024-06-20",19.01," silage"
"E9760","06/20/2024",25.92,"silage "
"V472","2024-06-20",13.25,"corn silage"
"S6097","06/20/2024",22.51,"silage "
"O6552","06-21-2024",19.13," hay "
"S5427","2024-06-21",21.97,"hay"
"N9197","2024-06-21",18.64,"corn silage"
"C7126","2024-06-21",18.22,"silage "
"J9639","06/21/2024",14.87," silage"
"R3357","21 Jun 2024",19.37," hay "
"V3979","21 Jun 2024",27.44," hay "
"K9325","21 Jun 2024",22.97,"hay"
"E3229","2024-06-21",25.03," hay "
"T5602","06/21/2024",22.74," hay "
"N9692","21 Jun 2024",23.43," silage"
"V4575","06/21/2024",22.71,"Hay"
"Y3782","06/21/2024",21.43,"Silage"
"Z7830","2024-06-21",18.25,"Silage"
"E5966","06/21/2024",18.4,"silge"
"S9300","06-21-2024",15.2,"silage"
"Y7815","2024-06-21",19.98,"hay"
"Y9266","06-21-2024",22.7," hay "
"I1385","21 Jun 2024",23.1,"corn silage"
"C4705","21 Jun 2024",20.29,"Hay"
"H2377","06-21-2024",18.36,"silge"
"Z4043","06/21/2024",29.87," silage"
"G685","06/21/2024",22.21,"Hay"
"J6077","06/21/2024",24.26,"silage"
"I5026","21 Jun 2024",18.99," silage"
"S6386","06/21/2024",19.89,"hay"
"D9038","21 Jun 2024",21.35," hay "
"N7280","06-21-2024",25.03,"hay"
"Q9174","21 Jun 2024",19.07,"corn silage"
"K4714","06-21-2024",22.56," hay "
"G150","06-21-2024",13.72," hay "
"U6809","21 Jun 2024",18.48,"hay"
"L9829","06-21-2024",16.12,"Hay"
"O8173","06-21-2024",23.34,"hay"
"J6910","21 Jun 2024",19.51,"Silage"
"M2207","21 Jun 2024",18.83,"Hay"
"G1028","06/21/2024",24.11," hay "
"I8517","06-21-2024",23.35,"corn silage"
"I7447","2024-06-21",17.31," hay "
"J7734","06-21-2024",21.28," hay "
"W8010","2024-06-21",16.31,"silge"
"U1955","21 Jun 2024",18.57," hay "
"G8171","06/21/2024",24.85,"silge"
"U5357","21 Jun 2024",24.35,"Silage"
"F5883","06-21-2024",23.33,"silage"
"Y4092","21 Jun 2024",18.29,"corn silage"
"B984","2024-06-21",14.36,"Hay"
"E6182","21 Jun 2024",16.47," silage"
"H985","06/21/2024",22.86,"silage"
"L4232","2024-06-21",19.13,"Hay"
"M1583","06/21/2024",13.51,"silage "
"R4684","21 Jun 2024",19.46,"hay"
"A7863","06-21-2024",24.23,"hay"
"Y4775","06/21/2024",21.93," silage"
"Y6643","21 Jun 2024",17.54,"silge"
"F9953","06-21-2024",15.36," hay "
"U8535","21 Jun 2024",17.52,"Silage"
"O7477","06/21/2024",20.1,"silage"
"I2506","2024-06-21",22.66,"silage "
"O194","21 Jun 2024",14.18,"hay"
"Z3123","06-21-2024",23.07,"Hay"
"P6677","06/21/2024",20.02,"Hay"
"T4649","06-21-2024",21.71,"hay"
"F2131","21 Jun 2024",15.04,"hay"
"K3463","06/21/2024",18," hay "
"H9517","06-21-2024",18.66,"corn silage"
"V3948","2024-06-21",23.13," silage"
"V7756","06-21-2024",23.08,"silge"
"G2757","2024-06-21",21.31,"silage"
"P3832","2024-06-21",24.81,"silage "
"Q711","06-21-2024",18.45," silage"
"V9643","06-21-2024",23.04,"silage"
"R5369","21 Jun 2024",19.89,"hay"
"Q3500","2024-06-21",18,"hay"
"B3068","21 Jun 2024",22.77," hay "
"D8719","21 Jun 2024",24.14,"hay"
"M4054","21 Jun 2024",22.63,"silge"
"E9760","06/21/2024",18.47,"silage "
"V472","2024-06-21",18.59,"silage "
"S6097","06/21/2024",24.13,"Silage"
"O6552","22 Jun 2024",21.06," hay "
"S5427","06-22-2024",22.49," hay "
"N9197","22 Jun 2024",18.98,"silage"
"C7126","22 Jun 2024",23.78,"corn silage"
"J9639","22 Jun 2024",17.57,"corn silage"
"R3357","22 Jun 2024",21.88," hay "
"V3979","06-22-2024",17.55,"Hay"
"K9325","2024-06-22",12.61," hay "
"E3229","06/22/2024",15.97,"hay"
"T5602","2024-06-22",20.41," hay "
"N9692","22 Jun 2024",22.65,"corn silage"
"V4575","06-22-2024",14.75,"hay"
"Y3782","06/22/2024",16.25,"silage "
"Z7830","2024-06-22",25.29," silage"
"E5966","22 Jun 2024",18.7,"silage "
"S9300","06-22-2024",21.52,"silge"
"Y7815","2024-06-22",18.42," hay "
"Y9266","2024-06-22",19.1,"hay"
"I1385","2024-06-22",20.26," silage"
"C4705","06/22/2024",20.03,"hay"
"H2377","06/22/2024",19.42,"silage"
"Z4043","2024-06-22",18.59,"corn silage"
"G685","06-22-2024",10.86,"hay"
"J6077","06-22-2024",25.61,"corn silage"
"I5026","2024-06-22",25.37,"silage "
"S6386","2024-06-22",16.7,"Hay"
"D9038","2024-06-22",19.5,"Hay"
"N7280","2024-06-22",24.13,"Hay"
"Q9174","06/22/2024",22.99,"silage "
"K4714","2024-06-22",23.83,"hay"
"G150","06/22/2024",16.78," hay "
"U6809","22 Jun 2024",27.73,"Hay"
"L9829","06/22/2024",16.6,"Hay"
"O8173","06-22-2024",22.26,"Hay"
"J6910","22 Jun 2024",20.42,"silage"
"M2207","2024-06-22",18.79,"hay"
"G1028","06/22/2024",18.86,"hay"
"I8517","2024-06-22",17.03,"silge"
"I7447","2024-06-22",24.87,"hay"
"J7734","06/22/2024",20.27,"Hay"
"W8010","22 Jun 2024",20.78,"Silage"
"U1955","06/22/2024",20.63,"Hay"
"G8171","06/22/2024",18.87,"silage"
"U5357","2024-06-22",16.6,"silge"
"F5883","22 Jun 2024",20.76,"corn silage"
"Y4092","06/22/2024",13.72,"silage "
"B984","2024-06-22",15.74," hay "
"E6182","22 Jun 2024",16.77,"Silage"
"H985","2024-06-22",16.76,"silage"
"L4232","2024-06-22",20.32," hay "
"M1583","2024-06-22",24.8,"corn silage"
"R4684","2024-06-22",15.45," hay "
"A7863","06/22/2024",21.3,"Hay"
"Y4775","2024-06-22",22.7,"corn silage"
"Y6643","2024-06-22",17.03,"Silage"
"F9953","22 Jun 2024",19.84,"Hay"
"U8535","06/22/2024",22.47," silage"
"O7477","2024-06-22",19.23,"corn silage"
"I2506","06/22/2024",19.34,"silge"
"O194","06/22/2024",20.92,"hay"
"Z3123","06-22-2024",19.82,"Hay"
"P6677","2024-06-22",18.33,"hay"
"T4649","06-22-2024",19.58," hay "
"F2131","06/22/2024",25.65,"hay"
"K3463","06-22-2024",22.62,"hay"
"H9517","2024-06-22",17.26,"silge"
"V3948","06/22/2024",16.27,"corn silage"
"V7756","06-22-2024",18.92,"Silage"
"G2757","06-22-2024",23.99,"silage "
"P3832","06-22-2024",20.88," silage"
"Q711","06/22/2024",17.9,"silage"
"V9643","06/22/2024",22.65,"silage"
"R5369","2024-06-22",19.6," hay "
"Q3500","06-22-2024",16.64,"Hay"
"B3068","06-22-2024",21.38,"hay"
"D8719","2024-06-22",24.57,"Hay"
"M4054","06-22-2024",21.3,"Silage"
"E9760","22 Jun 2024",20.58,"Silage"
"V472","06-22-2024",18.03,"Silage"
"S6097","2024-06-22",21.71,"silage "
"O6552","06-23-2024",16.79," hay "
"S5427","06-23-2024",15.04,"hay"
"N9197","23 Jun 2024",19.87,"silge"
"C7126","06/23/2024",19.9,"Silage"
"J9639","2024-06-23",27.1,"silage "
"R3357","06/23/2024",16.35," hay "
"V3979","06/23/2024",20.51,"hay"
"K9325","06/23/2024",22.42,"hay"
"E3229","23 Jun 2024",23.15," hay "
"T5602","23 Jun 2024",19.97,"Hay"
"N9692","06/23/2024",17.77,"silage "
"V4575","2024-06-23",19.8,"Hay"
"Y3782","2024-06-23",25.82,"silage"
"Z7830","06-23-2024",21.45," silage"
"E5966","06/23/2024",13.87,"corn silage"
"S9300","23 Jun 2024",24.27,"corn silage"
"Y7815","06/23/2024",21.62,"hay"
"Y9266","23 Jun 2024",19.9,"hay"
"I1385","06/23/2024",19.95,"silage"
"C4705","23 Jun 2024",19.55," hay "
"H2377","23 Jun 2024",20.77,"corn silage"
"Z4043","23 Jun 2024",18.49,"corn silage"
"G685","23 Jun 2024",20.83,"Hay"
"J6077","2024-06-23",17.21,"Silage"
"I5026","06-23-2024",20.6,"silage"
"S6386","06/23/2024",23.32,"Hay"
"D9038","06-23-2024",21.53,"hay"
"N7280","06/23/2024",23.1,"Hay"
"Q9174","06/23/2024",16.73,"silage"
"K4714","2024-06-23",20.16,"hay"
"G150","2024-06-23",21.85,"Hay"
"U6809","06-23-2024",16.8," hay "
"L9829","23 Jun 2024",24.7,"Hay"
"O8173","06/23/2024",16.9,"hay"
"J6910","06/23/2024",20.49," silage"
"M2207","06-23-2024",20.46,"Hay"
"G1028","06-23-2024",20.37," hay "
"I8517","23 Jun 2024",19.37,"silage"
"I7447","23 Jun 2024",21.35,"Hay"
"J7734","06/23/2024",16.91,"Hay"
"W8010","2024-06-23",16.13," silage"
"U1955","06/23/2024",18.04,"hay"
"G8171","23 Jun 2024",19.83,"silage "
"U5357","2024-06-23",23.77,"corn silage"
"F5883","06-23-2024",24.76,"Silage"
"Y4092","06/23/2024",20.96,"silge"
"B984","06/23/2024",21.14," hay "
"E6182","2024-06-23",19.27," silage"
"H985","06-23-2024",20.14,"silage"
"L4232","2024-06-23",15.79,"Hay"
"M1583","2024-06-23",20.87," silage"
"R4684","06-23-2024",18.39," hay "
"A7863","06-23-2024",21,"Hay"
"Y4775","06-23-2024",18.96,"silge"
"Y6643","06-23-2024",18.02,"silge"
"F9953","06-23-2024",19.34,"hay"
"U8535","2024-06-23",18.9,"silage"
"O7477","06/23/2024",23.28," silage"
"I2506","23 Jun 2024",20.63,"silge"
"O194","06-23-2024",21.3," hay "
"Z3123","2024-06-23",16.28," hay "
"P6677","23 Jun 2024",24.49,"hay"
"T4649","06-23-2024",20.48," hay "
"F2131","06/23/2024",17.43," hay "
"K3463","23 Jun 2024",20.93," hay "
"H9517","06/23/2024",22.61," silage"
"V3948","2024-06-23",15.85," silage"
"V7756","2024-06-23",25.07,"Silage"
"G2757","2024-06-23",19.53,"silage"
"P3832","06-23-2024",23.36,"silge"
"Q711","2024-06-23",20.22,"silge"
"V9643","06/23/2024",19,"corn silage"
"R5369","06/23/2024",14.5,"hay"
"Q3500","2024-06-23",16.7,"Hay"
"B3068","06-23-2024",19.88," hay "
"D8719","06-23-2024",22.48," hay "
"M4054","2024-06-23",14.35,"silage"
"E9760","23 Jun 2024",24.13,"silage "
"V472","23 Jun 2024",24.2,"silage "
"S6097","06/23/2024",16.57,"silage"
"O6552","06-24-2024",21.42,"Hay"
"S5427","06-24-2024",16.9,"Hay"
"N9197","06-24-2024",19.62,"silage "
"C7126","06/24/2024",22.79,"corn silage"
"J9639","2024-06-24",22.61,"corn silage"
"R3357","2024-06-24",17.45,"Hay"
"V3979","2024-06-24",NA,"hay"
"K9325","2024-06-24",17.07,"Hay"
"E3229","2024-06-24",21.02," hay "
"T5602","06/24/2024",15.32," hay "
"N9692","2024-06-24",12.11,"Silage"
"V4575","24 Jun 2024",24.41," hay "
"Y3782","24 Jun 2024",26.82,"Silage"
"Z7830","06/24/2024",18.63," silage"
"E5966","2024-06-24",22.28,"corn silage"
"S9300","06/24/2024",19.98,"Silage"
"Y7815","24 Jun 2024",24.42,"Hay"
"Y9266","06-24-2024",21.66," hay "
"I1385","06-24-2024",20.61,"silge"
"C4705","06/24/2024",14.6,"hay"
"H2377","06/24/2024",23.25,"corn silage"
"Z4043","06/24/2024",18.95,"corn silage"
"G685","2024-06-24",15.79,"Hay"
"J6077","2024-06-24",19.39,"Silage"
"I5026","2024-06-24",19.62," silage"
"S6386","24 Jun 2024",23.18," hay "
"D9038","24 Jun 2024",16.5,"hay"
"N7280","06/24/2024",18.33," hay "
"Q9174","06/24/2024",24.46,"silage"
"K4714","2024-06-24",24.08,"Hay"
"G150","24 Jun 2024",23.49,"Hay"
"U6809","2024-06-24",24.98,"Hay"
"L9829","06-24-2024",20.61," hay "
"O8173","06/24/2024",18.25,"Hay"
"J6910","24 Jun 2024",21.67," silage"
"M2207","2024-06-24",23.18,"hay"
"G1028","06-24-2024",27.24,"Hay"
"I8517","06/24/2024",14.11,"silage"
"I7447","06-24-2024",20.82," hay "
"J7734","06-24-2024",21.96,"Hay"
"W8010","06-24-2024",19.84,"silage"
"U1955","2024-06-24",15.33," hay "
"G8171","06-24-2024",22.22,"Silage"
"U5357","06-24-2024",17.66,"silge"
"F5883","06-24-2024",21.52," silage"
"Y4092","06-24-2024",22.72,"corn silage"
"B984","06-24-2024",23.85," hay "
"E6182","06-24-2024",15.33," silage"
"H985","2024-06-24",23.25,"silge"
"L4232","06/24/2024",17.73,"hay"
"M1583","06-24-2024",16.13,"silge"
"R4684","24 Jun 2024",23.94,"hay"
"A7863","06-24-2024",23.44," hay "
"Y4775","06/24/2024",19.27,"corn silage"
"Y6643","24 Jun 2024",22.28," silage"
"F9953","24 Jun 2024",17.42,"Hay"
"U8535","06/24/2024",19.55,"silage "
"O7477","06-24-2024",19.72," silage"
"I2506","2024-06-24",19.16," silage"
"O194","2024-06-24",22.2,"hay"
"Z3123","06/24/2024",24.61,"Hay"
"P6677","24 Jun 2024",18.63," hay "
"T4649","2024-06-24",19.9,"Hay"
"F2131","06-24-2024",24.91," hay "
"K3463","24 Jun 2024",19.01,"Hay"
"H9517","2024-06-24",12.19,"Silage"
"V3948","24 Jun 2024",21.54,"corn silage"
"V7756","06/24/2024",17.34," silage"
"G2757","06-24-2024",17,"silage"
"P3832","06/24/2024",24.26,"silge"
"Q711","2024-06-24",27.34,"silage"
"V9643","24 Jun 2024",16.88,"silge"
"R5369","24 Jun 2024",23.09,"Hay"
"Q3500","06/24/2024",19.72,"Hay"
"B3068","2024-06-24",20.43,"hay"
"D8719","24 Jun 2024",23.67,"hay"
"M4054","24 Jun 2024",20.64,"Silage"
"E9760","06-24-2024",17.45,"corn silage"
"V472","06/24/2024",18.59,"Silage"
"S6097","06-24-2024",22.06," silage"
"O6552","2024-06-25",12.99,"Hay"
"S5427","2024-06-25",23.29,"Hay"
"N9197","06/25/2024",15.3,"silage"
"C7126","06/25/2024",20.07,"Silage"
"J9639","06-25-2024",19.43,"silage "
"R3357","06-25-2024",23.88,"hay"
"V3979","25 Jun 2024",20.57,"hay"
"K9325","06-25-2024",20.31," hay "
"E3229","2024-06-25",22.09,"hay"
"T5602","25 Jun 2024",17.52," hay "
"N9692","25 Jun 2024",19.41,"Silage"
"V4575","25 Jun 2024",23.53,"hay"
"Y3782","25 Jun 2024",22.05,"corn silage"
"Z7830","06/25/2024",16.17," silage"
"E5966","06/25/2024",21.91,"silage "
"S9300","2024-06-25",15.87,"Silage"
"Y7815","06/25/2024",18.21,"hay"
"Y9266","06-25-2024",23.63,"Hay"
"I1385","2024-06-25",13.25,"Silage"
"C4705","06-25-2024",14.66,"hay"
"H2377","2024-06-25",23.9,"Silage"
"Z4043","06/25/2024",17.56,"Silage"
"G685","2024-06-25",23.73," hay "
"J6077","2024-06-25",19.5,"Silage"
"I5026","2024-06-25",21.28,"silge"
"S6386","06/25/2024",22.44,"Hay"
"D9038","06-25-2024",18.05," hay "
"N7280","25 Jun 2024",19.09," hay "
"Q9174","06/25/2024",18.75,"Silage"
"K4714","2024-06-25",28.45,"hay"
"G150","06/25/2024",20.38,"Hay"
"U6809","2024-06-25",21.42,"Hay"
"L9829","06-25-2024",18.98,"Hay"
"O8173","06-25-2024",19.27,"hay"
"J6910","06-25-2024",24.14,"silge"
"M2207","06-25-2024",NA,"hay"
"G1028","06/25/2024",20.06,"Hay"
"I8517","2024-06-25",21.13," silage"
"I7447","06-25-2024",18.7,"hay"
"J7734","06/25/2024",25.88,"Hay"
"W8010","2024-06-25",15.71,"silage"
"U1955","06-25-2024",26.03,"hay"
"G8171","06-25-2024",18.95,"silage "
"U5357","06-25-2024",24.07,"corn silage"
"F5883","06-25-2024",14," silage"
"Y4092","2024-06-25",22.87,"Silage"
"B984","06/25/2024",22.63," hay "
"E6182","06/25/2024",16.19," silage"
"H985","06-25-2024",17.7,"silage "
"L4232","06/25/2024",20.58,"hay"
"M1583","06-25-2024",23.43," silage"
"R4684","25 Jun 2024",17.7,"hay"
"A7863","06/25/2024",19.33," hay "
"Y4775","25 Jun 2024",24.71,"Silage"
"Y6643","06-25-2024",16.62,"Silage"
"F9953","2024-06-25",22.84,"hay"
"U8535","06-25-2024",21.35," silage"
"O7477","06/25/2024",16.68,"Silage"
"I2506","06/25/2024",18,"silage "
"O194","06/25/2024",22.35,"Hay"
"Z3123","25 Jun 2024",20.75,"hay"
"P6677","06-25-2024",24.28,"hay"
"T4649","06-25-2024",18.19," hay "
"F2131","2024-06-25",14.86,"Hay"
"K3463","2024-06-25",23.14,"Hay"
"H9517","06-25-2024",18.17," silage"
"V3948","06/25/2024",20.36,"Silage"
"V7756","25 Jun 2024",25.16,"silage "
"G2757","06/25/2024",19.25,"silge"
"P3832","25 Jun 2024",24.65,"Silage"
"Q711","06/25/2024",16.71,"Silage"
"V9643","2024-06-25",22.78,"Silage"
"R5369","2024-06-25",20.74,"Hay"
"Q3500","06-25-2024",17.79,"hay"
"B3068","25 Jun 2024",16.16,"Hay"
"D8719","25 Jun 2024",20.23,"Hay"
"M4054","2024-06-25",20.77,"Silage"
"E9760","06/25/2024",20.83,"corn silage"
"V472","2024-06-25",21.61," silage"
"S6097","06/25/2024",18.62," silage"
"O6552","06/26/2024",NA," hay "
"S5427","2024-06-26",20.71,"hay"
"N9197","06/26/2024",18.38,"silge"
"C7126","2024-06-26",23.66,"silage "
"J9639","2024-06-26",20.52,"Silage"
"R3357","06/26/2024",18.15," hay "
"V3979","06-26-2024",14.58,"Hay"
"K9325","06-26-2024",18.07,"hay"
"E3229","06-26-2024",26.14," hay "
"T5602","06-26-2024",18.32," hay "
"N9692","06/26/2024",17.49,"silage"
"V4575","26 Jun 2024",21.96,"hay"
"Y3782","26 Jun 2024",21.32,"corn silage"
"Z7830","06-26-2024",22.25,"Silage"
"E5966","06-26-2024",19.17,"silage"
"S9300","26 Jun 2024",NA,"silge"
"Y7815","2024-06-26",16.48,"hay"
"Y9266","06-26-2024",19.85,"hay"
"I1385","2024-06-26",17.89,"silge"
"C4705","2024-06-26",22.04," hay "
"H2377","2024-06-26",20.39,"silage "
"Z4043","06/26/2024",23.33,"Silage"
"G685","2024-06-26",26.18," hay "
"J6077","06-26-2024",NA," silage"
"I5026","06/26/2024",18.4,"silage "
"S6386","06/26/2024",NA,"Hay"
"D9038","2024-06-26",19.21,"hay"
"N7280","06/26/2024",19.79,"Hay"
"Q9174","2024-06-26",25.98,"silage "
"K4714","06/26/2024",16.61,"hay"
"G150","26 Jun 2024",16.72," hay "
"U6809","2024-06-26",18.78,"Hay"
"L9829","06/26/2024",21.76," hay "
"O8173","06/26/2024",22.46,"Hay"
"J6910","26 Jun 2024",17.28,"corn silage"
"M2207","06/26/2024",20.38,"hay"
"G1028","26 Jun 2024",19.87," hay "
"I8517","06-26-2024",23.59,"silage "
"I7447","06-26-2024",23.27,"hay"
"J7734","06/26/2024",19.06,"Hay"
"W8010","06-26-2024",20.14,"silage "
"U1955","06-26-2024",21.96,"Hay"
"G8171","26 Jun 2024",15.04," silage"
"U5357","2024-06-26",19.07,"Silage"
"F5883","2024-06-26",21.72,"corn silage"
"Y4092","2024-06-26",18.43,"silge"
"B984","06/26/2024",19.82," hay "
"E6182","2024-06-26",19.94,"Silage"
"H985","26 Jun 2024",17.83," silage"
"L4232","2024-06-26",17.02," hay "
"M1583","26 Jun 2024",19.4,"corn silage"
"R4684","2024-06-26",18.96,"Hay"
"A7863","2024-06-26",22.5,"Hay"
"Y4775","06/26/2024",24.59,"silge"
"Y6643","26 Jun 2024",19.96,"silage"
"F9953","06/26/2024",21.2,"Hay"
"U8535","26 Jun 2024",19.79,"silage"
"O7477","2024-06-26",21.8,"silge"
"I2506","06/26/2024",20.66,"Silage"
"O194","06-26-2024",20.71,"Hay"
"Z3123","06/26/2024",23.34," hay "
"P6677","26 Jun 2024",17.04,"hay"
"T4649","2024-06-26",24.34," hay "
"F2131","2024-06-26",21.05,"hay"
"K3463","26 Jun 2024",20.54,"hay"
"H9517","06-26-2024",18.32,"silge"
"V3948","06/26/2024",19.51," silage"
"V7756","26 Jun 2024",21.12,"Silage"
"G2757","26 Jun 2024",13.81,"silge"
"P3832","06/26/2024",18.2,"silage"
"Q711","06-26-2024",21.76,"silage "
"V9643","06-26-2024",19.12,"corn silage"
"R5369","06-26-2024",17.6," hay "
"Q3500","06/26/2024",18.09,"Hay"
"B3068","2024-06-26",20.71," hay "
"D8719","06-26-2024",15.1,"hay"
"M4054","06-26-2024",22.61," silage"
"E9760","06-26-2024",13.49,"silage "
"V472","06-26-2024",18.49,"silage"
"S6097","2024-06-26",17.64,"silge"
"O6552","06-27-2024",16.25," hay "
"S5427","27 Jun 2024",16.77,"hay"
"N9197","06-27-2024",20.75,"corn silage"
"C7126","2024-06-27",19.64," silage"
"J9639","2024-06-27",19.1,"silage "
"R3357","06-27-2024",13.04,"Hay"
"V3979","2024-06-27",16.03," hay "
"K9325","2024-06-27",19.61,"Hay"
"E3229","06-27-2024",17.37,"hay"
"T5602","2024-06-27",17.61,"hay"
"N9692","2024-06-27",23.15,"silge"
"V4575","2024-06-27",20.53,"Hay"
"Y3782","2024-06-27",16.87,"silage"
"Z7830","2024-06-27",18.59,"corn silage"
"E5966","2024-06-27",19.15,"corn silage"
"S9300","2024-06-27",17.96,"corn silage"
"Y7815","2024-06-27",17.11,"hay"
"Y9266","06-27-2024",19.84,"Hay"
"I1385","27 Jun 2024",22.22,"silage "
"C4705","27 Jun 2024",20.68,"Hay"
"H2377","06-27-2024",19.4," silage"
"Z4043","06-27-2024",21.16," silage"
"G685","27 Jun 2024",22.38,"hay"
"J6077","06/27/2024",19.58," silage"
"I5026","2024-06-27",21.37," silage"
"S6386","06-27-2024",16.56," hay "
"D9038","06-27-2024",19.25,"hay"
"N7280","06/27/2024",18.74,"hay"
"Q9174","2024-06-27",20.59,"silage "
"K4714","06/27/2024",21.07,"hay"
"G150","06/27/2024",19.63,"hay"
"U6809","2024-06-27",17.7,"Hay"
"L9829","27 Jun 2024",17.21,"Hay"
"O8173","06/27/2024",20.84,"hay"
"J6910","06/27/2024",24.07,"silage "
"M2207","27 Jun 2024",17.64,"Hay"
"G1028","06/27/2024",18.85,"hay"
"I8517","2024-06-27",20.99,"corn silage"
"I7447","06-27-2024",18.34," hay "
"J7734","27 Jun 2024",20.36," hay "
"W8010","2024-06-27",19.86," silage"
"U1955","06/27/2024",17.67," hay "
"G8171","27 Jun 2024",22.49,"silage "
"U5357","2024-06-27",22.54,"silage "
"F5883","27 Jun 2024",23.07,"silge"
"Y4092","2024-06-27",23.8,"silage "
"B984","27 Jun 2024",18.48,"hay"
"E6182","06/27/2024",18.61,"silage "
"H985","06/27/2024",20.78,"silge"
"L4232","06-27-2024",21.89,"Hay"
"M1583","27 Jun 2024",18.98,"silage"
"R4684","2024-06-27",18.73,"hay"
"A7863","06/27/2024",18.15,"hay"
"Y4775","06-27-2024",24.45," silage"
"Y6643","06/27/2024",12.48,"silage"
"F9953","06/27/2024",19.5," hay "
"U8535","2024-06-27",20.11," silage"
"O7477","2024-06-27",16.82,"corn silage"
"I2506","2024-06-27",21.16,"silage "
"O194","2024-06-27",14.1,"hay"
"Z3123","06-27-2024",22.86,"hay"
"P6677","27 Jun 2024",15.01,"hay"
"T4649","06/27/2024",13.39," hay "
"F2131","27 Jun 2024",17.71,"hay"
"K3463","06-27-2024",20.49," hay "
"H9517","06/27/2024",18.05," silage"
"V3948","2024-06-27",18.32,"Silage"
"V7756","06-27-2024",21,"silage "
"G2757","2024-06-27",16.82,"silge"
"P3832","27 Jun 2024",19.74,"corn silage"
"Q711","06-27-2024",21.49,"silage"
"V9643","2024-06-27",24.9,"Silage"
"R5369","06/27/2024",21.44,"Hay"
"Q3500","27 Jun 2024",25.14,"Hay"
"B3068","06-27-2024",21.36,"Hay"
"D8719","06/27/2024",19.99,"Hay"
"M4054","2024-06-27",13.23,"Silage"
"E9760","27 Jun 2024",16.33,"silage"
"V472","06-27-2024",19.04,"Silage"
"S6097","2024-06-27",22.14," silage"
"O6552","06-28-2024",19.03,"hay"
"S5427","28 Jun 2024",21.63,"Hay"
"N9197","06/28/2024",16.81,"corn silage"
"C7126","06/28/2024",19.18,"silge"
"J9639","06/28/2024",20.65," silage"
"R3357","2024-06-28",18.92," hay "
"V3979","28 Jun 2024",20.34,"Hay"
"K9325","06/28/2024",17.99,"Hay"
"E3229","06/28/2024",21.12,"Hay"
"T5602","06/28/2024",19.76,"Hay"
"N9692","28 Jun 2024",19.86,"silage "
"V4575","28 Jun 2024",14.15,"hay"
"Y3782","06/28/2024",17.98,"Silage"
"Z7830","28 Jun 2024",15.53,"corn silage"
"E5966","06/28/2024",15.18,"silage "
"S9300","2024-06-28",18.52,"corn silage"
"Y7815","06-28-2024",19.52," hay "
"Y9266","06/28/2024",20.85," hay "
"I1385","06/28/2024",23.27,"silge"
"C4705","28 Jun 2024",21.33,"hay"
"H2377","06/28/2024",23.04,"silge"
"Z4043","06/28/2024",18.42,"silage "
"G685","06/28/2024",19.08,"hay"
"J6077","06/28/2024",23.26,"corn silage"
"I5026","06-28-2024",20,"silage"
"S6386","28 Jun 2024",14.96," hay "
"D9038","28 Jun 2024",17.46,"Hay"
"N7280","28 Jun 2024",23.02,"hay"
"Q9174","28 Jun 2024",18.17,"silage"
"K4714","06-28-2024",21," hay "
"G150","2024-06-28",20.04,"hay"
"U6809","06/28/2024",18.51," hay "
"L9829","06/28/2024",18.95," hay "
"O8173","28 Jun 2024",21.18,"hay"
"J6910","2024-06-28",20.63,"Silage"
"M2207","06-28-2024",23.7,"hay"
"G1028","06-28-2024",19.4," hay "
"I8517","28 Jun 2024",17.23,"silage"
"I7447","06-28-2024",20.5,"hay"
"J7734","2024-06-28",22.12,"Hay"
"W8010","28 Jun 2024",26.85,"corn silage"
"U1955","28 Jun 2024",18.61,"hay"
"G8171","2024-06-28",19.02,"silge"
"U5357","06/28/2024",22.65,"silage"
"F5883","2024-06-28",23.84,"silage"
"Y4092","2024-06-28",18.02,"Silage"
"B984","06-28-2024",21.99,"Hay"
"E6182","06/28/2024",18.3," silage"
"H985","28 Jun 2024",17.11,"silage "
"L4232","28 Jun 2024",21.87,"hay"
"M1583","2024-06-28",20.32,"Silage"
"R4684","28 Jun 2024",21.17,"hay"
"A7863","06/28/2024",18.26," hay "
"Y4775","28 Jun 2024",25.38,"silage"
"Y6643","28 Jun 2024",22," silage"
"F9953","06/28/2024",18.88,"Hay"
"U8535","28 Jun 2024",22.11," silage"
"O7477","06/28/2024",16.36,"corn silage"
"I2506","2024-06-28",19.59,"corn silage"
"O194","06-28-2024",24.21,"hay"
"Z3123","2024-06-28",19.43,"Hay"
"P6677","28 Jun 2024",22.73,"Hay"
"T4649","2024-06-28",19.33," hay "
"F2131","06-28-2024",13.11,"Hay"
"K3463","28 Jun 2024",17.36," hay "
"H9517","28 Jun 2024",20.67," silage"
"V3948","2024-06-28",24.34,"silge"
"V7756","06-28-2024",18.22,"silage "
"G2757","2024-06-28",20.83,"silage"
"P3832","06/28/2024",17.11,"silage "
"Q711","06/28/2024",16.95,"Silage"
"V9643","28 Jun 2024",17.67,"corn silage"
"R5369","06/28/2024",24.11," hay "
"Q3500","06-28-2024",22.82,"Hay"
"B3068","2024-06-28",21.78,"Hay"
"D8719","2024-06-28",23.35,"Hay"
"M4054","06/28/2024",18.73,"corn silage"
"E9760","28 Jun 2024",22.28," silage"
"V472","2024-06-28",20.63," silage"
"S6097","06/28/2024",16.85,"silge"
"O6552","29 Jun 2024",17.51,"hay"
"S5427","2024-06-29",20.15,"hay"
"N9197","06-29-2024",20.62,"corn silage"
"C7126","06-29-2024",19.04,"corn silage"
"J9639","29 Jun 2024",17.01,"corn silage"
"R3357","06-29-2024",13.73,"hay"
"V3979","06/29/2024",21.28,"Hay"
"K9325","06/29/2024",19.11,"hay"
"E3229","06-29-2024",21.65,"Hay"
"T5602","2024-06-29",15.36,"hay"
"N9692","06/29/2024",16.24," silage"
"V4575","06/29/2024",19.67,"hay"
"Y3782","2024-06-29",15.76,"silge"
"Z7830","06-29-2024",14.05,"Silage"
"E5966","2024-06-29",22.35,"silage"
"S9300","2024-06-29",22.7,"Silage"
"Y7815","29 Jun 2024",16.91,"Hay"
"Y9266","06-29-2024",19.18,"hay"
"I1385","29 Jun 2024",16.6,"corn silage"
"C4705","06/29/2024",20.95,"hay"
"H2377","2024-06-29",19.91,"Silage"
"Z4043","06/29/2024",17.39,"silage"
"G685","06/29/2024",17.68,"hay"
"J6077","2024-06-29",16.81,"silge"
"I5026","06/29/2024",21.31,"Silage"
"S6386","06/29/2024",21.71," hay "
"D9038","2024-06-29",21.13,"Hay"
"N7280","29 Jun 2024",17.47,"Hay"
"Q9174","29 Jun 2024",14.64,"silage "
"K4714","2024-06-29",21.59,"hay"
"G150","29 Jun 2024",19.47,"hay"
"U6809","06-29-2024",19.88," hay "
"L9829","06-29-2024",23.1,"hay"
"O8173","06/29/2024",17.32," hay "
"J6910","06-29-2024",23.43,"silage "
"M2207","29 Jun 2024",18.76," hay "
"G1028","06/29/2024",17.86," hay "
"I8517","2024-06-29",19.38,"silage"
"I7447","29 Jun 2024",21.17," hay "
"J7734","29 Jun 2024",19.38,"Hay"
"W8010","06-29-2024",17.3,"corn silage"
"U1955","29 Jun 2024",19.16,"Hay"
"G8171","06/29/2024",12.37,"silage"
"U5357","06-29-2024",18.47,"corn silage"
"F5883","29 Jun 2024",21.37,"Silage"
"Y4092","2024-06-29",19.49,"silage"
"B984","06-29-2024",22.06,"Hay"
"E6182","06-29-2024",21.46,"silage"
"H985","06/29/2024",21.94," silage"
"L4232","06/29/2024",21.97,"Hay"
"M1583","2024-06-29",14.78,"silage "
"R4684","2024-06-29",20.01," hay "
"A7863","29 Jun 2024",24.89,"hay"
"Y4775","06/29/2024",18.56,"Silage"
"Y6643","06-29-2024",21.36,"Silage"
"F9953","06/29/2024",20.43,"hay"
"U8535","06-29-2024",21.67,"silage "
"O7477","06/29/2024",19.18,"Silage"
"I2506","06-29-2024",18.06,"corn silage"
"O194","06-29-2024",20.22,"hay"
"Z3123","29 Jun 2024",20.62,"hay"
"P6677","29 Jun 2024",19.44,"Hay"
"T4649","2024-06-29",20.09,"Hay"
"F2131","29 Jun 2024",21.23,"hay"
"K3463","2024-06-29",17.67,"hay"
"H9517","2024-06-29",23.42,"Silage"
"V3948","06-29-2024",26.6,"silage"
"V7756","06-29-2024",24.43,"corn silage"
"G2757","06/29/2024",18.64,"Silage"
"P3832","29 Jun 2024",14.53,"silage "
"Q711","06/29/2024",20.16," silage"
"V9643","29 Jun 2024",22.64,"Silage"
"R5369","2024-06-29",22.33," hay "
"Q3500","06-29-2024",16.31," hay "
"B3068","29 Jun 2024",16.66,"hay"
"D8719","2024-06-29",20.4,"hay"
"M4054","06/29/2024",21.88,"silage "
"E9760","29 Jun 2024",22.62,"Silage"
"V472","06-29-2024",22.45,"silge"
"S6097","06-29-2024",17.1,"silage "
"O6552","06/30/2024",16.06," hay "
"S5427","2024-06-30",13.96," hay "
"N9197","2024-06-30",21.51," silage"
"C7126","30 Jun 2024",22.48,"corn silage"
"J9639","2024-06-30",21.01,"Silage"
"R3357","06-30-2024",16.82," hay "
"V3979","06/30/2024",24.7,"Hay"
"K9325","06-30-2024",18.89,"Hay"
"E3229","06-30-2024",25.34,"Hay"
"T5602","2024-06-30",21.65,"Hay"
"N9692","30 Jun 2024",NA,"silge"
"V4575","2024-06-30",20.99,"Hay"
"Y3782","2024-06-30",19.81,"Silage"
"Z7830","2024-06-30",16.96,"corn silage"
"E5966","06/30/2024",18.32,"silage"
"S9300","30 Jun 2024",19.86,"Silage"
"Y7815","06/30/2024",20.85,"hay"
"Y9266","30 Jun 2024",19.9,"hay"
"I1385","06/30/2024",19.47,"Silage"
"C4705","2024-06-30",20.55,"Hay"
"H2377","06/30/2024",18.43,"silge"
"Z4043","2024-06-30",18.39," silage"
"G685","2024-06-30",15.63," hay "
"J6077","06-30-2024",22.54,"silage "
"I5026","30 Jun 2024",20.14,"Silage"
"S6386","06-30-2024",19.75," hay "
"D9038","06-30-2024",17.78," hay "
"N7280","30 Jun 2024",19.26,"hay"
"Q9174","06/30/2024",16.74," silage"
"K4714","30 Jun 2024",16.85,"hay"
"G150","2024-06-30",14.24,"Hay"
"U6809","06/30/2024",22.95," hay "
"L9829","06/30/2024",20.38," hay "
"O8173","06/30/2024",16.65," hay "
"J6910","30 Jun 2024",23.49,"silage "
"M2207","2024-06-30",21.87,"Hay"
"G1028","06-30-2024",22.23," hay "
"I8517","2024-06-30",19.32,"silage"
"I7447","06-30-2024",18.73," hay "
"J7734","06-30-2024",19.71,"Hay"
"W8010","06/30/2024",21.21,"silage"
"U1955","30 Jun 2024",22.4," hay "
"G8171","06-30-2024",24.77,"silage"
"U5357","06-30-2024",18.47,"silage "
"F5883","2024-06-30",16.95,"silage "
"Y4092","2024-06-30",20.3,"Silage"
"B984","06-30-2024",29.07," hay "
"E6182","30 Jun 2024",18.71,"Silage"
"H985","06/30/2024",23.44,"silage "
"L4232","06-30-2024",19.27," hay "
"M1583","06/30/2024",18.56," silage"
"R4684","06-30-2024",17.87,"Hay"
"A7863","06-30-2024",19.37,"hay"
"Y4775","30 Jun 2024",24.93," silage"
"Y6643","06/30/2024",20.91,"corn silage"
"F9953","30 Jun 2024",21.46,"Hay"
"U8535","06/30/2024",22.52,"silage"
"O7477","06-30-2024",26.22,"Silage"
"I2506","30 Jun 2024",22.33,"corn silage"
"O194","2024-06-30",15.72,"hay"
"Z3123","06/30/2024",16.9," hay "
"P6677","06-30-2024",15.23,"Hay"
"T4649","2024-06-30",11.45,"Hay"
"F2131","2024-06-30",23.87," hay "
"K3463","2024-06-30",18.52," hay "
"H9517","30 Jun 2024",21.18,"corn silage"
"V3948","30 Jun 2024",23.54,"silge"
"V7756","30 Jun 2024",18.46,"silage"
"G2757","30 Jun 2024",19.6,"Silage"
"P3832","2024-06-30",21.05,"silage"
"Q711","06/30/2024",20.68," silage"
"V9643","30 Jun 2024",17.68,"silage "
"R5369","30 Jun 2024",22.19,"hay"
"Q3500","06/30/2024",21.64,"Hay"
"B3068","06-30-2024",19.13,"hay"
"D8719","06-30-2024",16.33," hay "
"M4054","06/30/2024",21.9,"silage"
"E9760","06/30/2024",24.28,"silage"
"V472","06/30/2024",24.14,"silage "
"S6097","06-30-2024",22.62,"Silage"
"O6552","01 Jul 2024",18.55,"Hay"
"S5427","07-01-2024",18.41," hay "
"N9197","01 Jul 2024",18.24,"silge"
"C7126","01 Jul 2024",18.76," silage"
"J9639","2024-07-01",22.13," silage"
"R3357","01 Jul 2024",20.77,"Hay"
"V3979","07-01-2024",14.43," hay "
"K9325","07/01/2024",14.42,"hay"
"E3229","07-01-2024",19.93," hay "
"T5602","01 Jul 2024",20.45,"Hay"
"N9692","2024-07-01",13.08,"silage "
"V4575","07/01/2024",17.55,"hay"
"Y3782","07-01-2024",20.08,"silage"
"Z7830","2024-07-01",24.39,"Silage"
"E5966","07-01-2024",13.96,"silage"
"S9300","01 Jul 2024",16.23,"Silage"
"Y7815","07-01-2024",16.76," hay "
"Y9266","07-01-2024",20.53," hay "
"I1385","07-01-2024",20.99," silage"
"C4705","01 Jul 2024",19.04," hay "
"H2377","07-01-2024",15.16," silage"
"Z4043","2024-07-01",18.11,"silge"
"G685","01 Jul 2024",18.32,"hay"
"J6077","07-01-2024",19.39,"Silage"
"I5026","07/01/2024",24.87,"silge"
"S6386","07-01-2024",17.97,"Hay"
"D9038","2024-07-01",20.23,"Hay"
"N7280","01 Jul 2024",17.88,"hay"
"Q9174","07-01-2024",16.28,"silage"
"K4714","2024-07-01",21.91,"Hay"
"G150","07-01-2024",16.85,"Hay"
"U6809","07-01-2024",28.21," hay "
"L9829","2024-07-01",20.28,"hay"
"O8173","07/01/2024",20.18,"Hay"
"J6910","07/01/2024",19.8," silage"
"M2207","01 Jul 2024",25.53," hay "
"G1028","2024-07-01",21.99," hay "
"I8517","2024-07-01",19.25,"Silage"
"I7447","2024-07-01",16.5,"Hay"
"J7734","07-01-2024",16.88," hay "
"W8010","2024-07-01",17.65,"silge"
"U1955","01 Jul 2024",23.64,"Hay"
"G8171","2024-07-01",19.43," silage"
"U5357","07-01-2024",17.73,"silage"
"F5883","07/01/2024",22.38,"Silage"
"Y4092","2024-07-01",24.04,"silge"
"B984","07/01/2024",17.92," hay "
"E6182","01 Jul 2024",18.67,"silage "
"H985","2024-07-01",21.04,"corn silage"
"L4232","07-01-2024",19.99,"hay"
"M1583","07/01/2024",21.22,"corn silage"
"R4684","2024-07-01",25.14,"Hay"
"A7863","01 Jul 2024",19.82,"Hay"
"Y4775","07/01/2024",19.16,"silge"
"Y6643","01 Jul 2024",21.46,"Silage"
"F9953","2024-07-01",19.85," hay "
"U8535","2024-07-01",21.88,"silage"
"O7477","07/01/2024",19.33,"Silage"
"I2506","07/01/2024",21.33,"silage "
"O194","2024-07-01",15.31," hay "
"Z3123","07/01/2024",20.04,"Hay"
"P6677","07/01/2024",18.45,"hay"
"T4649","07/01/2024",16.43,"hay"
"F2131","07-01-2024",18.76,"hay"
"K3463","2024-07-01",21.12,"Hay"
"H9517","2024-07-01",20.28,"silge"
"V3948","07/01/2024",22.08,"silage"
"V7756","01 Jul 2024",22.82," silage"
"G2757","07-01-2024",22.49,"silage"
"P3832","07-01-2024",19.03,"silage "
"Q711","07/01/2024",16.02," silage"
"V9643","01 Jul 2024",19.16,"Silage"
"R5369","01 Jul 2024",23.51," hay "
"Q3500","07-01-2024",19.64,"Hay"
"B3068","07-01-2024",15.09,"hay"
"D8719","01 Jul 2024",21.47,"hay"
"M4054","2024-07-01",20.85," silage"
"E9760","07-01-2024",18.8,"Silage"
"V472","01 Jul 2024",20.52,"Silage"
"S6097","01 Jul 2024",24.11," silage"
"O6552","07-02-2024",23.9,"Hay"
"S5427","2024-07-02",18.63,"hay"
"N9197","07-02-2024",20.03,"silage"
"C7126","2024-07-02",15.64,"corn silage"
"J9639","02 Jul 2024",17.82," silage"
"R3357","2024-07-02",26.02,"hay"
"V3979","02 Jul 2024",24.49," hay "
"K9325","07-02-2024",19.31,"hay"
"E3229","07-02-2024",17.92,"Hay"
"T5602","07/02/2024",15.9,"hay"
"N9692","07-02-2024",26.38,"Silage"
"V4575","02 Jul 2024",20.34,"Hay"
"Y3782","07-02-2024",18.22,"corn silage"
"Z7830","07/02/2024",23.23,"silage"
"E5966","07/02/2024",16.7,"corn silage"
"S9300","07/02/2024",22.18,"corn silage"
"Y7815","07-02-2024",24.32,"Hay"
"Y9266","02 Jul 2024",19.37," hay "
"I1385","2024-07-02",24.35,"silage"
"C4705","07-02-2024",21.92," hay "
"H2377","2024-07-02",17.96," silage"
"Z4043","02 Jul 2024",21.72," silage"
"G685","07/02/2024",17.89," hay "
"J6077","2024-07-02",18.4,"Silage"
"I5026","07-02-2024",22.32,"silage "
"S6386","07-02-2024",18.57,"Hay"
"D9038","07-02-2024",19.93," hay "
"N7280","07-02-2024",23.06,"hay"
"Q9174","07-02-2024",16.38,"corn silage"
"K4714","2024-07-02",24.79,"Hay"
"G150","07/02/2024",26.13,"hay"
"U6809","07-02-2024",21.84," hay "
"L9829","07-02-2024",21.27," hay "
"O8173","2024-07-02",18.51," hay "
"J6910","2024-07-02",21.47,"corn silage"
"M2207","07-02-2024",18.49,"Hay"
"G1028","2024-07-02",20.86," hay "
"I8517","07-02-2024",17.94,"silge"
"I7447","07/02/2024",22.37,"Hay"
"J7734","07/02/2024",22.07,"Hay"
"W8010","02 Jul 2024",23.73,"silage "
"U1955","02 Jul 2024",25.95,"hay"
"G8171","2024-07-02",18.06,"silage "
"U5357","02 Jul 2024",22.9,"silge"
"F5883","2024-07-02",15.72,"corn silage"
"Y4092","2024-07-02",18.63,"Silage"
"B984","2024-07-02",22.84,"hay"
"E6182","07/02/2024",17.78,"silge"
"H985","2024-07-02",21.04,"silge"
"L4232","07-02-2024",17.3,"hay"
"M1583","07/02/2024",18.89,"silage "
"R4684","2024-07-02",19.88,"hay"
"A7863","02 Jul 2024",18.16," hay "
"Y4775","02 Jul 2024",14.16,"Silage"
"Y6643","07/02/2024",20.73,"Silage"
"F9953","07/02/2024",21.42,"Hay"
"U8535","07/02/2024",20.41,"silge"
"O7477","07-02-2024",18.53,"silage"
"I2506","2024-07-02",22.7,"silage"
"O194","07-02-2024",23.23," hay "
"Z3123","2024-07-02",12.88,"hay"
"P6677","07/02/2024",23.37,"hay"
"T4649","07-02-2024",14.66," hay "
"F2131","07/02/2024",18.97,"Hay"
"K3463","02 Jul 2024",16.67,"Hay"
"H9517","02 Jul 2024",18.11,"silge"
"V3948","02 Jul 2024",23.95,"silage "
"V7756","07/02/2024",21.6,"corn silage"
"G2757","02 Jul 2024",21.48,"silage "
"P3832","02 Jul 2024",13.77,"corn silage"
"Q711","02 Jul 2024",20.59,"silage"
"V9643","02 Jul 2024",21.89,"silge"
"R5369","2024-07-02",22.58," hay "
"Q3500","07-02-2024",17.08,"Hay"
"B3068","02 Jul 2024",22.81,"Hay"
"D8719","2024-07-02",15.81,"hay"
"M4054","07/02/2024",25.22," silage"
"E9760","07-02-2024",17.6,"silage"
"V472","07-02-2024",22.3," silage"
"S6097","2024-07-02",20.95," silage"
"O6552","2024-07-03",16.81,"hay"
"S5427","07/03/2024",23.43,"Hay"
"N9197","03 Jul 2024",20.1,"corn silage"
"C7126","07/03/2024",22.46,"silge"
"J9639","07/03/2024",20.65," silage"
"R3357","2024-07-03",22.61,"Hay"
"V3979","2024-07-03",20.07,"Hay"
"K9325","07-03-2024",23.35,"Hay"
"E3229","07/03/2024",18.94,"hay"
"T5602","2024-07-03",21.58,"Hay"
"N9692","2024-07-03",21.14,"silage"
"V4575","07/03/2024",22.53,"hay"
"Y3782","07/03/2024",18.14," silage"
"Z7830","03 Jul 2024",20.53," silage"
"E5966","07-03-2024",18.26,"silage "
"S9300","07/03/2024",22.73,"silage "
"Y7815","07/03/2024",18.09," hay "
"Y9266","07-03-2024",25.2,"Hay"
"I1385","07/03/2024",22.37,"silage"
"C4705","07/03/2024",19.96," hay "
"H2377","03 Jul 2024",23.62,"silge"
"Z4043","07-03-2024",19.75,"corn silage"
"G685","07/03/2024",21.69," hay "
"J6077","03 Jul 2024",21.58,"silge"
"I5026","07-03-2024",21.27," silage"
"S6386","2024-07-03",18.21," hay "
"D9038","03 Jul 2024",16.25,"hay"
"N7280","03 Jul 2024",14.96," hay "
"Q9174","07-03-2024",18.63,"silge"
"K4714","07-03-2024",22.05,"Hay"
"G150","2024-07-03",19.28,"Hay"
"U6809","07-03-2024",16.39,"Hay"
"L9829","03 Jul 2024",26.47,"hay"
"O8173","2024-07-03",22.11," hay "
"J6910","07/03/2024",25.84,"Silage"
"M2207","07-03-2024",23.64,"hay"
"G1028","07/03/2024",18.17," hay "
"I8517","03 Jul 2024",18.76,"silage "
"I7447","07/03/2024",15.68,"hay"
"J7734","2024-07-03",22.22,"hay"
"W8010","03 Jul 2024",24.87,"silge"
"U1955","07-03-2024",17.24," hay "
"G8171","03 Jul 2024",16.39," silage"
"U5357","03 Jul 2024",22.65,"Silage"
"F5883","07-03-2024",15.45,"silage"
"Y4092","07/03/2024",25.76," silage"
"B984","03 Jul 2024",21.72,"hay"
"E6182","2024-07-03",14.86,"silge"
"H985","07/03/2024",21.06," silage"
"L4232","2024-07-03",20.32,"Hay"
"M1583","07/03/2024",12.59,"silage"
"R4684","07-03-2024",19.87,"Hay"
"A7863","03 Jul 2024",18.24,"Hay"
"Y4775","2024-07-03",17.34,"silage "
"Y6643","07-03-2024",20.72,"silage "
"F9953","07/03/2024",22.55,"hay"
"U8535","03 Jul 2024",25.18," silage"
"O7477","07-03-2024",12.1,"Silage"
"I2506","07-03-2024",22.23,"Silage"
"O194","2024-07-03",17.14,"hay"
"Z3123","2024-07-03",23.47,"hay"
"P6677","2024-07-03",21.04,"Hay"
"T4649","07/03/2024",24.33,"hay"
"F2131","07-03-2024",15.55,"Hay"
"K3463","03 Jul 2024",21.48," hay "
"H9517","2024-07-03",20.89,"Silage"
"V3948","07-03-2024",23.14,"silge"
"V7756","07-03-2024",19.31,"silage"
"G2757","2024-07-03",23.43,"Silage"
"P3832","03 Jul 2024",18.67,"silage "
"Q711","07-03-2024",18.71,"silage "
"V9643","2024-07-03",20.08,"corn silage"
"R5369","03 Jul 2024",16.79,"hay"
"Q3500","07-03-2024",18.63,"hay"
"B3068","03 Jul 2024",23.33," hay "
"D8719","07-03-2024",24.96,"Hay"
"M4054","07/03/2024",23.34,"silage "
"E9760","2024-07-03",18.73,"corn silage"
"V472","07-03-2024",20.96,"silage "
"S6097","07-03-2024",20.3,"silage "
"O6552","07/04/2024",16.22,"Hay"
"S5427","07-04-2024",20.77,"hay"
"N9197","07-04-2024",17.53,"Silage"
"C7126","04 Jul 2024",16.82,"Silage"
"J9639","04 Jul 2024",22.18,"silge"
"R3357","07-04-2024",17.88," hay "
"V3979","07-04-2024",19.57," hay "
"K9325","2024-07-04",17.08,"hay"
"E3229","07/04/2024",20.17,"hay"
"T5602","2024-07-04",21.48,"Hay"
"N9692","07-04-2024",21.51,"silge"
"V4575","2024-07-04",16.77,"hay"
"Y3782","2024-07-04",23.77,"silge"
"Z7830","07-04-2024",24.48," silage"
"E5966","07-04-2024",21.12,"silage"
"S9300","04 Jul 2024",20.47,"corn silage"
"Y7815","07-04-2024",20.23,"hay"
"Y9266","2024-07-04",20.77," hay "
"I1385","07/04/2024",21.13,"corn silage"
"C4705","04 Jul 2024",20.41,"Hay"
"H2377","2024-07-04",21.96,"silage"
"Z4043","07-04-2024",18.99,"silge"
"G685","07/04/2024",23.39," hay "
"J6077","07/04/2024",19.89,"silage "
"I5026","07/04/2024",14.73,"corn silage"
"S6386","07/04/2024",19.7,"hay"
"D9038","07-04-2024",21.34,"Hay"
"N7280","04 Jul 2024",23.69,"Hay"
"Q9174","07/04/2024",20.18,"Silage"
"K4714","04 Jul 2024",14.18,"hay"
"G150","2024-07-04",20.01," hay "
"U6809","07-04-2024",16.4,"Hay"
"L9829","07/04/2024",17.07," hay "
"O8173","07/04/2024",16.92,"Hay"
"J6910","2024-07-04",17.6," silage"
"M2207","07/04/2024",23.41," hay "
"G1028","2024-07-04",17.51,"Hay"
"I8517","07-04-2024",18.68,"silage "
"I7447","07/04/2024",20.55,"Hay"
"J7734","07/04/2024",22.67," hay "
"W8010","07-04-2024",18," silage"
"U1955","04 Jul 2024",17.52,"hay"
"G8171","04 Jul 2024",18.44,"Silage"
"U5357","07/04/2024",16.48,"Silage"
"F5883","2024-07-04",22.76,"corn silage"
"Y4092","07/04/2024",13.45,"silage"
"B984","07-04-2024",18.42," hay "
"E6182","07-04-2024",15.68,"silge"
"H985","2024-07-04",14.13,"silage "
"L4232","2024-07-04",20.09,"hay"
"M1583","07/04/2024",24.61," silage"
"R4684","04 Jul 2024",24.9,"hay"
"A7863","2024-07-04",18.31,"Hay"
"Y4775","04 Jul 2024",17.91,"silge"
"Y6643","07/04/2024",18.39,"silage"
"F9953","2024-07-04",22.13," hay "
"U8535","2024-07-04",12.31,"silage "
"O7477","04 Jul 2024",20.74,"corn silage"
"I2506","2024-07-04",18.78,"Silage"
"O194","04 Jul 2024",17.77,"hay"
"Z3123","07-04-2024",13.98," hay "
"P6677","07/04/2024",19.38,"Hay"
"T4649","04 Jul 2024",15.05,"hay"
"F2131","07/04/2024",19.95," hay "
"K3463","04 Jul 2024",17.32,"hay"
"H9517","07/04/2024",20.14," silage"
"V3948","04 Jul 2024",21.38," silage"
"V7756","07/04/2024",NA," silage"
"G2757","2024-07-04",16.93,"silage "
"P3832","07-04-2024",18.16," silage"
"Q711","07-04-2024",18,"silage"
"V9643","07-04-2024",15.52,"silge"
"R5369","04 Jul 2024",17.66," hay "
"Q3500","04 Jul 2024",19.42,"hay"
"B3068","07/04/2024",19.34," hay "
"D8719","2024-07-04",20.99,"hay"
"M4054","07-04-2024",23.88,"silage "
"E9760","07/04/2024",21,"corn silage"
"V472","2024-07-04",24.43,"corn silage"
"S6097","07-04-2024",18.06,"silge"
"O6552","07-05-2024",24.05,"hay"
"S5427","07-05-2024",21.78," hay "
"N9197","07-05-2024",16.42,"silge"
"C7126","07-05-2024",21.21,"silage "
"J9639","2024-07-05",16.29,"corn silage"
"R3357","07-05-2024",22.84,"hay"
"V3979","05 Jul 2024",18.38,"hay"
"K9325","05 Jul 2024",19.29," hay "
"E3229","05 Jul 2024",17.96,"Hay"
"T5602","07-05-2024",17.44,"Hay"
"N9692","05 Jul 2024",25.11,"silage "
"V4575","05 Jul 2024",22.98,"hay"
"Y3782","05 Jul 2024",22.03," silage"
"Z7830","07/05/2024",20.22,"silge"
"E5966","05 Jul 2024",22.21," silage"
"S9300","2024-07-05",21.99,"silge"
"Y7815","07/05/2024",24.81,"Hay"
"Y9266","07-05-2024",22.55," hay "
"I1385","2024-07-05",19.38,"silge"
"C4705","07-05-2024",19.36," hay "
"H2377","05 Jul 2024",18.6,"silage"
"Z4043","2024-07-05",18.91,"corn silage"
"G685","2024-07-05",19.29," hay "
"J6077","05 Jul 2024",23.67,"corn silage"
"I5026","07-05-2024",13.01,"silage "
"S6386","07/05/2024",17.89," hay "
"D9038","2024-07-05",19.6," hay "
"N7280","07/05/2024",16.15," hay "
"Q9174","05 Jul 2024",24.86,"corn silage"
"K4714","05 Jul 2024",19.3,"Hay"
"G150","07/05/2024",16.65," hay "
"U6809","2024-07-05",17.33,"hay"
"L9829","05 Jul 2024",22.62,"hay"
"O8173","07/05/2024",25.61,"Hay"
"J6910","07-05-2024",19.63,"silage"
"M2207","05 Jul 2024",20.32,"hay"
"G1028","07-05-2024",17.15," hay "
"I8517","07-05-2024",23.95,"corn silage"
"I7447","07-05-2024",22.17," hay "
"J7734","05 Jul 2024",13.01,"Hay"
"W8010","2024-07-05",18.06,"silage"
"U1955","07/05/2024",19.3," hay "
"G8171","05 Jul 2024",16.68,"silage"
"U5357","07-05-2024",19.18,"silage"
"F5883","07-05-2024",16.6,"silage "
"Y4092","07-05-2024",21.08," silage"
"B984","2024-07-05",21.01,"Hay"
"E6182","2024-07-05",22.43,"silage"
"H985","07-05-2024",21.25,"silage "
"L4232","07/05/2024",24.78," hay "
"M1583","05 Jul 2024",18.84,"Silage"
"R4684","05 Jul 2024",13.54,"Hay"
"A7863","07-05-2024",20.08," hay "
"Y4775","05 Jul 2024",21.95,"silge"
"Y6643","07/05/2024",18.8,"Silage"
"F9953","05 Jul 2024",24.2,"Hay"
"U8535","07-05-2024",23.28,"silge"
"O7477","07-05-2024",21.61,"silage "
"I2506","05 Jul 2024",20.21,"silge"
"O194","07-05-2024",18.35,"hay"
"Z3123","07/05/2024",19.47,"Hay"
"P6677","2024-07-05",21.41,"hay"
"T4649","05 Jul 2024",22.9,"hay"
"F2131","2024-07-05",19.11,"hay"
"K3463","07/05/2024",17.82,"Hay"
"H9517","05 Jul 2024",27.43," silage"
"V3948","07/05/2024",21.56," silage"
"V7756","07-05-2024",17.29,"corn silage"
"G2757","2024-07-05",22.79,"corn silage"
"P3832","07/05/2024",20.19,"Silage"
"Q711","07-05-2024",22.48,"silage "
"V9643","07/05/2024",20.16,"corn silage"
"R5369","2024-07-05",19.82,"Hay"
"Q3500","05 Jul 2024",20.27," hay "
"B3068","05 Jul 2024",21.24," hay "
"D8719","05 Jul 2024",18.17," hay "
"M4054","2024-07-05",18.03," silage"
"E9760","05 Jul 2024",19.45," silage"
"V472","2024-07-05",20.51," silage"
"S6097","07-05-2024",19.05,"corn silage"
"O6552","07/06/2024",20.95," hay "
"S5427","07-06-2024",16.69," hay "
"N9197","06 Jul 2024",15.71,"silge"
"C7126","2024-07-06",25.68,"silage "
"J9639","07/06/2024",21.19,"silage "
"R3357","2024-07-06",18.81,"Hay"
"V3979","2024-07-06",19.16,"hay"
"K9325","07-06-2024",22.36,"Hay"
"E3229","2024-07-06",19.37,"Hay"
"T5602","2024-07-06",20.58,"Hay"
"N9692","2024-07-06",19.21,"silge"
"V4575","2024-07-06",18.5,"hay"
"Y3782","07-06-2024",21.81,"Silage"
"Z7830","2024-07-06",20.42,"corn silage"
"E5966","06 Jul 2024",23.91,"Silage"
"S9300","07/06/2024",16.62,"silage"
"Y7815","07/06/2024",19.59,"hay"
"Y9266","2024-07-06",19.37,"hay"
"I1385","2024-07-06",16.78,"silage "
"C4705","2024-07-06",22.99," hay "
"H2377","06 Jul 2024",19.68,"silage "
"Z4043","2024-07-06",15.84,"silage "
"G685","2024-07-06",18.22,"Hay"
"J6077","07/06/2024",16.68,"silge"
"I5026","07-06-2024",23.12,"Silage"
"S6386","07/06/2024",27.63,"hay"
"D9038","2024-07-06",17.98,"Hay"
